slug,title_en,title_es,short_description_en,short_description_es,category,app_type,pricing_en,pricing_es,image_url,redirect_url,tags_en,tags_es,search_index_en,search_index_es
boostbot,Boostbot,[TRANSLATE-es] Boostbot,"Automate mobile gaming tasks, enhancing efficiency and focus.…","[TRANSLATE-es] Automate mobile gaming tasks, enhancing efficiency and focus.…",personal-assistant,other,Information not available,[TRANSLATE-es] Information not available,https://www.futurepedia.io/api/og?title=Boostbot+AI+Reviews%3A+Use+Cases%2C+Pricing+%26+Alternatives&image=https%3A%2F%2Fcdn.futurepedia.io%2F466b85eca523452f8e4e1ff6bf6dc494ddddef98-2529x1249.jpg,https://discord.gg/uk6a3GZ,,[TRANSLATE-es] ,"boostbot automate mobile gaming tasks, enhancing efficiency and focus. ","boostbot automate mobile gaming tasks, enhancing efficiency and focus. "
magic-travel,Magic Travel,[TRANSLATE-es] Magic Travel,Your All-in-One Trip Planning Tool…,[TRANSLATE-es] Your All-in-One Trip Planning Tool…,personal-assistant,other,Information not available,[TRANSLATE-es] Information not available,https://www.futurepedia.io/api/og?title=Magic+Travel+AI+Reviews%3A+Use+Cases%2C+Pricing+%26+Alternatives&image=https%3A%2F%2Fcdn.futurepedia.io%2Fe76207ac73f08d3887a9ce27372b70d036bd8f9a-2546x1250.png,https://tally.so/r/nWEKPQ,,[TRANSLATE-es] ,magic travel your all-in-one trip planning tool ,magic travel your all-in-one trip planning herramienta 
geldheldenai,Geldhelden.AI,[TRANSLATE-es] Geldhelden.AI,AI-driven platform enhancing financial decision-making and personalized strategies.…,[TRANSLATE-es] AI-driven platform enhancing financial decision-making and personalized strategies.…,personal-assistant,other,Information not available,[TRANSLATE-es] Information not available,https://www.futurepedia.io/api/og?title=Geldhelden.AI+Reviews%3A+Use+Cases%2C+Pricing+%26+Alternatives&image=https%3A%2F%2Fcdn.futurepedia.io%2Fd9e5d8ed7c6073f20f4c7071a3e410cd25d915a1-2528x1252.jpg,https://app.uptrends.ai/trending?utm_campaign=Futurepedia,,[TRANSLATE-es] ,geldhelden.ai ai-driven platform enhancing financial decision-making and personalized strategies. ,geldhelden.ia ia-driven platform enhancing financial decision-making and personalized strategies. 
assets-scout,Assets Scout,[TRANSLATE-es] Assets Scout,AI-driven tool for real-time asset tracking and management.…,[TRANSLATE-es] AI-driven tool for real-time asset tracking and management.…,personal-assistant,other,Information not available,[TRANSLATE-es] Information not available,https://www.futurepedia.io/api/og?title=Assets+Scout+AI+Reviews%3A+Use+Cases%2C+Pricing+%26+Alternatives&image=https%3A%2F%2Fcdn.futurepedia.io%2Ff18f066e89e07c0202d67448b2265cf0faff8a8c-1920x913.png,https://www.youtube.com/channel/UCvoujjptCeCL0r_P9CDk8yw,,[TRANSLATE-es] ,assets scout ai-driven tool for real-time asset tracking and management. ,assets scout ia-driven herramienta for real-time asset tracking and management. 
thinkforce,Thinkforce,[TRANSLATE-es] Thinkforce,Maximize productivity with AI-driven task automation and real-time insights.…,[TRANSLATE-es] Maximize productivity with AI-driven task automation and real-time insights.…,personal-assistant,other,Information not available,[TRANSLATE-es] Information not available,https://www.futurepedia.io/api/og?title=Thinkforce+AI+Reviews%3A+Use+Cases%2C+Pricing+%26+Alternatives&image=https%3A%2F%2Fcdn.futurepedia.io%2Fb748cc17cf077b446bc67fd2e229b8cfbff80ef5-2534x1270.jpg,https://discord.gg/hYKNByWRyv,,[TRANSLATE-es] ,thinkforce maximize productivity with ai-driven task automation and real-time insights. ,thinkforce maximize productivity with ia-driven task automation and real-time insights. 
bashsenpai,BashSenpai,[TRANSLATE-es] BashSenpai,AI assistant transforms instructions into terminal commands seamlessly.…,[TRANSLATE-es] AI assistant transforms instructions into terminal commands seamlessly.…,personal-assistant,assistant,Information not available,[TRANSLATE-es] Information not available,https://www.futurepedia.io/api/og?title=BashSenpai+Reviews%3A+Use+Cases%2C+Pricing+%26+Alternatives&image=https%3A%2F%2Fcdn.futurepedia.io%2Fd7ea2576ade7200c23873fc4cf8513b5535fcc36-2530x1270.jpg,https://twitter.com/bash_senpai,,[TRANSLATE-es] ,bashsenpai ai assistant transforms instructions into terminal commands seamlessly. ,bashsenpia ia asistente transforms instructions into terminal commands seamlessly. 
fusebase-ai,FuseBase AI,[TRANSLATE-es] FuseBase AI,AI-driven tool for seamless client collaboration and project management.…,[TRANSLATE-es] AI-driven tool for seamless client collaboration and project management.…,personal-assistant,other,Information not available,[TRANSLATE-es] Information not available,https://www.futurepedia.io/api/og?title=FuseBase+AI+Reviews%3A+Use+Cases%2C+Pricing+%26+Alternatives&image=https%3A%2F%2Fcdn.futurepedia.io%2Fa4d3437d890a9dbee0aaf5f2c08fa271bfb5afde-2516x1245.png,https://www.facebook.com/nimbuswebme,,[TRANSLATE-es] ,fusebase ai ai-driven tool for seamless client collaboration and project management. ,fusebase ia ia-driven herramienta for seamless client collaboration and project management. 
ask-layla,Ask Layla,[TRANSLATE-es] Ask Layla,Revolutionize travel with AI-driven planning and seamless bookings.…,[TRANSLATE-es] Revolutionize travel with AI-driven planning and seamless bookings.…,personal-assistant,other,Information not available,[TRANSLATE-es] Information not available,https://www.futurepedia.io/api/og?title=Ask+Layla+AI+Reviews%3A+Use+Cases%2C+Pricing+%26+Alternatives&image=https%3A%2F%2Fcdn.futurepedia.io%2F47faedc0550193b88a630bc63c8d2b1545ed94bb-2492x1228.png,https://tally.so/r/nWEKPQ,,[TRANSLATE-es] ,ask layla revolutionize travel with ai-driven planning and seamless bookings. ,ask layla revolutionize travel with ia-driven planning and seamless bookings. 
noah,Noah,[TRANSLATE-es] Noah,Revolutionize legal documentation with AI-crafted demand letters.…,[TRANSLATE-es] Revolutionize legal documentation with AI-crafted demand letters.…,personal-assistant,other,Information not available,[TRANSLATE-es] Information not available,https://www.futurepedia.io/api/og?title=Noah+AI+Reviews%3A+Use+Cases%2C+Pricing+%26+Alternatives&image=https%3A%2F%2Fcdn.futurepedia.io%2F2025-02-01T02-25-25.482Z-ouvpgEETuRKLZASQ4O8IXEn-YrqXCje-r.PNG,https://www.linkedin.com/company/tavrnla/,,[TRANSLATE-es] ,noah revolutionize legal documentation with ai-crafted demand letters. ,noah revolutionize legal documentation with ia-crafted demand letters. 
chaton,ChatOn,[TRANSLATE-es] ChatOn,"Revolutionize writing and creativity with AI: text-to-image, PDF mastery, voice transcription.…","[TRANSLATE-es] Revolutionize writing and creativity with AI: text-to-image, PDF mastery, voice transcription.…",personal-assistant,assistant,Information not available,[TRANSLATE-es] Information not available,https://www.futurepedia.io/api/og?title=ChatOn+AI+Reviews%3A+Use+Cases%2C+Pricing+%26+Alternatives&image=https%3A%2F%2Fcdn.futurepedia.io%2F948fe9a9e32a076271b8e2e918850026f114ec02-1716x1057.jpg,https://tally.so/r/nWEKPQ,,[TRANSLATE-es] ,"chaton revolutionize writing and creativity with ai: text-to-image, pdf mastery, voice transcription. ","chaton revolutionize escritura and creativity with ia: text-to-imagen, pdf mastery, voice transcription. "
zoom-ai-companion,Zoom AI Companion,[TRANSLATE-es] Zoom AI Companion,"Streamline meetings with AI summaries, chat assistance, and multilingual support.…","[TRANSLATE-es] Streamline meetings with AI summaries, chat assistance, and multilingual support.…",personal-assistant,assistant,Information not available,[TRANSLATE-es] Information not available,https://www.futurepedia.io/api/og?title=Zoom+AI+Companion+AI+Reviews%3A+Use+Cases%2C+Pricing+%26+Alternatives&image=https%3A%2F%2Fcdn.futurepedia.io%2Fe132c0d46af1135dfe026a8210c1590840e93c07-2525x1242.png,https://www.linkedin.com/company/zoom-video-communications,,[TRANSLATE-es] ,"zoom ai companion streamline meetings with ai summaries, chat assistance, and multilingual support. ","zoom ia companion streamline meetings with ia summaries, chat assistance, and multilingual support. "
goheather,goHeather,[TRANSLATE-es] goHeather,"AI-driven contract analysis, multilingual, lawyer-trained, time-saving tool.…","[TRANSLATE-es] AI-driven contract analysis, multilingual, lawyer-trained, time-saving tool.…",personal-assistant,other,Information not available,[TRANSLATE-es] Information not available,https://www.futurepedia.io/api/og?title=goHeather+AI+Reviews%3A+Use+Cases%2C+Pricing+%26+Alternatives&image=https%3A%2F%2Fcdn.futurepedia.io%2F1ae190e3d82401d4a6c6b3b69d4610679e47221e-2518x1229.png,https://www.linkedin.com/company/heatherhr/,,[TRANSLATE-es] ,"goheather ai-driven contract analysis, multilingual, lawyer-trained, time-saving tool. ","goheather ia-driven contract analysis, multilingual, lawyer-trianed, time-saving herramienta. "
blitzbear,BlitzBear,[TRANSLATE-es] BlitzBear,AI-driven platform revolutionizing project management and team collaboration.…,[TRANSLATE-es] AI-driven platform revolutionizing project management and team collaboration.…,personal-assistant,other,Information not available,[TRANSLATE-es] Information not available,https://www.futurepedia.io/api/og?title=BlitzBear+AI+Reviews%3A+Use+Cases%2C+Pricing+%26+Alternatives&image=https%3A%2F%2Fcdn.futurepedia.io%2F2025-01-31T23-44-54.325Z-4axIkxgRvOwBW3CEbMbVmg9_vjqcJLWUi.PNG,https://soofy.io/index/ref?&r=1674589108949x536014008447273100,,[TRANSLATE-es] ,blitzbear ai-driven platform revolutionizing project management and team collaboration. ,blitzbear ia-driven platform revolutionizing project management and team collaboration. 
qashboard,QashBoard,[TRANSLATE-es] QashBoard,"Streamline finances with AI insights and secure, customizable data management.…","[TRANSLATE-es] Streamline finances with AI insights and secure, customizable data management.…",personal-assistant,other,Information not available,[TRANSLATE-es] Information not available,https://www.futurepedia.io/api/og?title=QashBoard+AI+Reviews%3A+Use+Cases%2C+Pricing+%26+Alternatives&image=https%3A%2F%2Fcdn.futurepedia.io%2Ff26a78496286a15efabd9ffa9316b03c16246b4e-2516x1243.png,https://twitter.com/relume_io,,[TRANSLATE-es] ,"qashboard streamline finances with ai insights and secure, customizable data management. ","qashboard streamline finances with ia insights and secure, customizable data management. "
gajix,GAJIX,[TRANSLATE-es] GAJIX,"Revolutionize learning with AI: instant insights, comprehensive syllabus, enhanced understanding.…","[TRANSLATE-es] Revolutionize learning with AI: instant insights, comprehensive syllabus, enhanced understanding.…",personal-assistant,other,Information not available,[TRANSLATE-es] Information not available,https://www.futurepedia.io/api/og?title=GAJIX++AI+Reviews%3A+Use+Cases%2C+Pricing+%26+Alternatives&image=https%3A%2F%2Fcdn.futurepedia.io%2F0e5cc7590fbcf452033fe24cf76c355ba48c320d-2506x1223.jpg,https://appsumo.8odi.net/xkbAPO,,[TRANSLATE-es] ,"gajix revolutionize learning with ai: instant insights, comprehensive syllabus, enhanced understanding. ","gajix revolutionize learning with ia: instant insights, comprehensive syllabus, enhanced understanding. "
luzia,Luzia,[TRANSLATE-es] Luzia,"Unlock daily tasks, creative ideas, and instant answers with Luzia.…","[TRANSLATE-es] Unlock daily tasks, creative ideas, and instant answers with Luzia.…",personal-assistant,other,Information not available,[TRANSLATE-es] Information not available,https://www.futurepedia.io/api/og?title=Luzia+AI+Reviews%3A+Use+Cases%2C+Pricing+%26+Alternatives&image=https%3A%2F%2Fcdn.futurepedia.io%2Fc846e270d67918cf0e39328c58346ed5a663a6b4-2511x1234.png,https://www.instagram.com/luzia.es/,,[TRANSLATE-es] ,"luzia unlock daily tasks, creative ideas, and instant answers with luzia. ","luzia unlock dialy tasks, creative ideas, and instant answers with luzia. "
mindy,Mindy,[TRANSLATE-es] Mindy,Transform your email into an AI-powered command center.…,[TRANSLATE-es] Transform your email into an AI-powered command center.…,personal-assistant,other,Information not available,[TRANSLATE-es] Information not available,https://www.futurepedia.io/api/og?title=Mindy+AI+Reviews%3A+Use+Cases%2C+Pricing+%26+Alternatives&image=https%3A%2F%2Fcdn.futurepedia.io%2Fffdf2d4d75187010bd3ccab368a941b72289ed83-1920x1080.png,https://www.instagram.com/mindy.insta/,,[TRANSLATE-es] ,mindy transform your email into an ai-powered command center. ,mindy transform your emial into an ia-powered command center. 
pantera-deals,Pantera Deals,[TRANSLATE-es] Pantera Deals,"Deals surfaced from commands, not keywords.…","[TRANSLATE-es] Deals surfaced from commands, not keywords.…",personal-assistant,other,Information not available,[TRANSLATE-es] Information not available,https://www.futurepedia.io/api/og?title=Pantera+Deals+AI+Reviews%3A+Use+Cases%2C+Pricing+%26+Alternatives&image=https%3A%2F%2Fcdn.futurepedia.io%2F2025-05-14T21-57-09.870Z-6SyGzP_EWQqcwHqLlpRjvSP1LsAn9wnU5.png,https://tally.so/r/nWEKPQ,,[TRANSLATE-es] ,"pantera deals deals surfaced from commands, not keywords. ","pantera deals deals surfaced from commands, not keywords. "
videoideas-ai,VideoIdeas.ai,[TRANSLATE-es] VideoIdeas.ai,Effortlessly generate viral YouTube scripts and growth strategies.…,[TRANSLATE-es] Effortlessly generate viral YouTube scripts and growth strategies.…,personal-assistant,generator,Information not available,[TRANSLATE-es] Information not available,https://www.futurepedia.io/api/og?title=VideoIdeas.ai+Reviews%3A+Use+Cases%2C+Pricing+%26+Alternatives&image=https%3A%2F%2Fcdn.futurepedia.io%2F2025-03-14T15-19-16.231Z-uEh2WuG_O_i95AMqS4GFHId-Y9sLuhn4c.blob,https://www.synthesia.io/?via=fp,,[TRANSLATE-es] ,videoideas.ai effortlessly generate viral youtube scripts and growth strategies. ,videoideas.ia effortlessly generate viral youtube scripts and growth strategies. 
free-ai-resume-generator,Free AI Resume Generator,[TRANSLATE-es] Free AI Resume Generator,"Create professional, ATS-optimized resumes instantly with AI.…","[TRANSLATE-es] Create professional, ATS-optimized resumes instantly with AI.…",personal-assistant,generator,Information not available,[TRANSLATE-es] Information not available,https://www.futurepedia.io/api/og?title=Free+AI+Resume+Generator+AI+Reviews%3A+Use+Cases%2C+Pricing+%26+Alternatives&image=https%3A%2F%2Fcdn.futurepedia.io%2F2024-12-30T16-40-24.896Z-J5Uuqc55xJqjPdNUwap1MJOLUOPsHAloP.blob,https://www.linkedin.com/company/remotepeoplecom/,,[TRANSLATE-es] ,"free ai resume generator create professional, ats-optimized resumes instantly with ai. ","free ia resume generador create professional, ats-optimized resumes instantly with ia. "
manus,Manus,[TRANSLATE-es] Manus,"Transforms thoughts into actions, enhancing productivity and efficiency.…","[TRANSLATE-es] Transforms thoughts into actions, enhancing productivity and efficiency.…",personal-assistant,other,Information not available,[TRANSLATE-es] Information not available,https://www.futurepedia.io/api/og?title=Manus+AI+Reviews%3A+Use+Cases%2C+Pricing+%26+Alternatives&image=https%3A%2F%2Fcdn.futurepedia.io%2F2025-03-11T15-08-38.637Z-OjGJk3V89az_jF09ilkxuSuXHBfN01Xww.blob,https://x.com/ManusAI_HQ,,[TRANSLATE-es] ,"manus transforms thoughts into actions, enhancing productivity and efficiency. ","manus transforms thoughts into actions, enhancing productivity and efficiency. "
post-boost,Post-Boost,[TRANSLATE-es] Post-Boost,Schedule and post content across multiple platforms.…,[TRANSLATE-es] Schedule and post content across multiple platforms.…,personal-assistant,other,Information not available,[TRANSLATE-es] Information not available,https://www.futurepedia.io/api/og?title=Post-Boost+AI+Reviews%3A+Use+Cases%2C+Pricing+%26+Alternatives&image=https%3A%2F%2Fcdn.futurepedia.io%2F2025-07-03T18-29-06.330Z-1SaF50a8MvsgPgBvGf3v2PM3I-zjaCDe7.png,https://glambase.app/?ref=FUTUREPEDIA15,,[TRANSLATE-es] ,post-boost schedule and post content across multiple platforms. ,post-boost schedule and post content across multiple platforms. 
sanctum,Sanctum AI,[TRANSLATE-es] Sanctum AI,"Local, private AI assistant ensuring encrypted data stays on your Mac.…","[TRANSLATE-es] Local, private AI assistant ensuring encrypted data stays on your Mac.…",personal-assistant,assistant,Information not available,[TRANSLATE-es] Information not available,https://www.futurepedia.io/api/og?title=Sanctum+AI+Reviews%3A+Use+Cases%2C+Pricing+%26+Alternatives&image=https%3A%2F%2Fcdn.futurepedia.io%2F002f044de2a6be699cac8f6788d3e95b1d3a2129-2447x1168.png,https://discord.gg/gTf4GaG9eH,,[TRANSLATE-es] ,"sanctum ai local, private ai assistant ensuring encrypted data stays on your mac. ","sanctum ia local, private ia asistente ensuring encrypted data stays on your mac. "
portfoliogpt,PortfolioGPT,[TRANSLATE-es] PortfolioGPT,"Automates personalized portfolio creation, optimizing investment strategies effortlessly.…","[TRANSLATE-es] Automates personalized portfolio creation, optimizing investment strategies effortlessly.…",personal-assistant,other,Information not available,[TRANSLATE-es] Information not available,https://www.futurepedia.io/api/og?title=PortfolioGPT+AI+Reviews%3A+Use+Cases%2C+Pricing+%26+Alternatives&image=https%3A%2F%2Fcdn.futurepedia.io%2F2025-03-24T16-28-55.449Z-A1gY04ySJQ7BIYbHfAyPeeYxmBTrzibga.png,https://x.com/z_alexander_x,,[TRANSLATE-es] ,"portfoliogpt automates personalized portfolio creation, optimizing investment strategies effortlessly. ","portfoliogpt automates personalized portfolio creation, optimizing investment strategies effortlessly. "
thunderbit,Thunderbit,[TRANSLATE-es] Thunderbit,Scrape leads & other data in just 2-clicks. Built for sales & ops teams. Powered by AI.…,[TRANSLATE-es] Scrape leads & other data in just 2-clicks. Built for sales & ops teams. Powered by AI.…,personal-assistant,other,Information not available,[TRANSLATE-es] Information not available,https://www.futurepedia.io/api/og?title=Thunderbit+AI+Reviews%3A+Use+Cases%2C+Pricing+%26+Alternatives&image=https%3A%2F%2Fcdn.futurepedia.io%2F2025-01-20T18-10-44.545Z-x61qNthJZfZ99OPnoTMXYQL7F8uYh3npZ.png,https://twitter.com/ThunderbitHQ,,[TRANSLATE-es] ,thunderbit scrape leads & other data in just 2-clicks. built for sales & ops teams. powered by ai. ,thunderbit scrape leads & other data in just 2-clicks. built for sales & ops teams. powered by ia. 
clearword,Clearword,[TRANSLATE-es] Clearword,"AI-driven meeting assistant for note-taking, summaries, and actionable follow-ups.…","[TRANSLATE-es] AI-driven meeting assistant for note-taking, summaries, and actionable follow-ups.…",personal-assistant,assistant,Information not available,[TRANSLATE-es] Information not available,https://www.futurepedia.io/api/og?title=Clearword+AI+Reviews%3A+Use+Cases%2C+Pricing+%26+Alternatives&image=https%3A%2F%2Fcdn.futurepedia.io%2Fb0611918eb588d97e4a51c7d85871f055dae330d-2510x1235.png,https://www.linkedin.com/company/clearword/,,[TRANSLATE-es] ,"clearword ai-driven meeting assistant for note-taking, summaries, and actionable follow-ups. ","clearword ia-driven meeting asistente for note-taking, summaries, and actionable follow-ups. "
twin,Twin,[TRANSLATE-es] Twin,"Automate repetitive tasks effortlessly with intelligent, action-driven AI.…","[TRANSLATE-es] Automate repetitive tasks effortlessly with intelligent, action-driven AI.…",personal-assistant,other,Information not available,[TRANSLATE-es] Information not available,https://www.futurepedia.io/api/og?title=Twin+AI+Reviews%3A+Use+Cases%2C+Pricing+%26+Alternatives&image=https%3A%2F%2Fcdn.futurepedia.io%2F18f8320a4616888b0c377dae6ec58477e02a4e3a-1920x1080.png,https://www.linkedin.com/in/clementdelangue/,,[TRANSLATE-es] ,"twin automate repetitive tasks effortlessly with intelligent, action-driven ai. ","twin automate repetitive tasks effortlessly with intelligent, action-driven ia. "
essence-app,Essence App,[TRANSLATE-es] Essence App,Optimize life with cycle-synced productivity and wellness tools.…,[TRANSLATE-es] Optimize life with cycle-synced productivity and wellness tools.…,personal-assistant,other,Information not available,[TRANSLATE-es] Information not available,https://www.futurepedia.io/api/og?title=Essence+App+AI+Reviews%3A+Use+Cases%2C+Pricing+%26+Alternatives&image=https%3A%2F%2Fcdn.futurepedia.io%2Fa1089db03c5bdc82b700641648837f398705d547-1920x1080.jpg,https://www.linkedin.com/company/theessenceapp,,[TRANSLATE-es] ,essence app optimize life with cycle-synced productivity and wellness tools. ,essence app optimize life with cycle-synced productivity and wellness herramientas. 
capmonster-cloud,Capmonster Cloud,[TRANSLATE-es] Capmonster Cloud,"Automates CAPTCHA-solving, enhancing productivity with AI precision.…","[TRANSLATE-es] Automates CAPTCHA-solving, enhancing productivity with AI precision.…",personal-assistant,other,Information not available,[TRANSLATE-es] Information not available,https://www.futurepedia.io/api/og?title=Capmonster+Cloud+AI+Reviews%3A+Use+Cases%2C+Pricing+%26+Alternatives&image=https%3A%2F%2Fcdn.futurepedia.io%2F2025-02-27T21-18-37.560Z-FUhSkU8F7toQUT3xuFz-6ZtuHwnW1zzPk.png,https://www.youtube.com/@CapMonsterCloud,,[TRANSLATE-es] ,"capmonster cloud automates captcha-solving, enhancing productivity with ai precision. ","capmonster cloud automates captcha-solving, enhancing productivity with ia precision. "
maxai,MaxAI.me,[TRANSLATE-es] MaxAI.me,"Revolutionize productivity with 1-Click AI: Chat, summarize, translate, and visualize effortlessly.…","[TRANSLATE-es] Revolutionize productivity with 1-Click AI: Chat, summarize, translate, and visualize effortlessly.…",personal-assistant,assistant,Information not available,[TRANSLATE-es] Information not available,https://www.futurepedia.io/api/og?title=MaxAI.me+AI+Reviews%3A+Use+Cases%2C+Pricing+%26+Alternatives&image=https%3A%2F%2Fcdn.futurepedia.io%2Fb463fd7c229c67fcd9dc53374f08508441cde0ab-2501x1224.png,https://tally.so/r/nWEKPQ,,[TRANSLATE-es] ,"maxai.me revolutionize productivity with 1-click ai: chat, summarize, translate, and visualize effortlessly. ","maxia.me revolutionize productivity with 1-click ia: chat, summarize, translate, and visualize effortlessly. "
whoop,Whoop,[TRANSLATE-es] Whoop,"Optimize fitness, sleep, and recovery with real-time health insights.…","[TRANSLATE-es] Optimize fitness, sleep, and recovery with real-time health insights.…",personal-assistant,other,Information not available,[TRANSLATE-es] Information not available,https://www.futurepedia.io/api/og?title=Whoop+AI+Reviews%3A+Use+Cases%2C+Pricing+%26+Alternatives&image=https%3A%2F%2Fcdn.futurepedia.io%2Ff0715ef51bd6068453408120d9ef09e79098d96c-2500x1217.png,https://tally.so/r/nWEKPQ,,[TRANSLATE-es] ,"whoop optimize fitness, sleep, and recovery with real-time health insights. ","whoop optimize fitness, sleep, and recovery with real-time health insights. "
jace,Jace,[TRANSLATE-es] Jace,"Automate tasks, optimize workflows, enhance productivity with AI.…","[TRANSLATE-es] Automate tasks, optimize workflows, enhance productivity with AI.…",personal-assistant,other,Information not available,[TRANSLATE-es] Information not available,https://www.futurepedia.io/api/og?title=Jace+AI+Reviews%3A+Use+Cases%2C+Pricing+%26+Alternatives&image=https%3A%2F%2Fcdn.futurepedia.io%2F2025-02-14T20-05-20.550Z-YTTlc8NuoyH4gAo0A_QHSeAR4axqGDW85.png,https://questionreality--snapilabs.thrivecart.com/marketingblocks-bundle-unlimited/,,[TRANSLATE-es] ,"jace automate tasks, optimize workflows, enhance productivity with ai. ","jace automate tasks, optimize workflows, enhance productivity with ia. "
kintext,Kintext,[TRANSLATE-es] Kintext,"AI-driven parenting assistant offering personalized advice, milestone tracking, and community support.…","[TRANSLATE-es] AI-driven parenting assistant offering personalized advice, milestone tracking, and community support.…",personal-assistant,assistant,Information not available,[TRANSLATE-es] Information not available,https://www.futurepedia.io/api/og?title=Kintext+AI+Reviews%3A+Use+Cases%2C+Pricing+%26+Alternatives&image=https%3A%2F%2Fcdn.futurepedia.io%2F8962e7ba57b12ef569f21a21d1bc783941a4037b-2518x1194.png,https://twitter.com/KintextAI,,[TRANSLATE-es] ,"kintext ai-driven parenting assistant offering personalized advice, milestone tracking, and community support. ","kintext ia-driven parenting asistente offering personalized advice, milestone tracking, and community support. "
plumb,Plumb,[TRANSLATE-es] Plumb,Automate workflows with AI templates for enhanced productivity.…,[TRANSLATE-es] Automate workflows with AI templates for enhanced productivity.…,personal-assistant,other,Information not available,[TRANSLATE-es] Information not available,https://www.futurepedia.io/api/og?title=Plumb+AI+Reviews%3A+Use+Cases%2C+Pricing+%26+Alternatives&image=https%3A%2F%2Fcdn.futurepedia.io%2F2025-02-01T01-06-27.066Z-ZYPeNCu14n4yCTdaKofxNZb_1Ik6FXmsk.PNG,https://twitter.com/useplumb,,[TRANSLATE-es] ,plumb automate workflows with ai templates for enhanced productivity. ,plumb automate workflows with ia templates for enhanced productivity. 
eve-legal,Eve Legal,[TRANSLATE-es] Eve Legal,AI-driven legal tool streamlining case management for plaintiff firms.…,[TRANSLATE-es] AI-driven legal tool streamlining case management for plaintiff firms.…,personal-assistant,other,Information not available,[TRANSLATE-es] Information not available,https://www.futurepedia.io/api/og?title=Eve+Legal+AI+Reviews%3A+Use+Cases%2C+Pricing+%26+Alternatives&image=https%3A%2F%2Fcdn.futurepedia.io%2F2025-02-14T20-07-17.883Z-8zRirnTpaNUwLPI-zSVMOduOSuWWo2rzU.png,https://twitter.com/evelegalai,,[TRANSLATE-es] ,eve legal ai-driven legal tool streamlining case management for plaintiff firms. ,eve legal ia-driven legal herramienta streamlining case management for pliantiff firms. 
