slug,title_en,title_es,short_description_en,short_description_es,category,app_type,pricing_en,pricing_es,image_url,redirect_url,tags_en,tags_es,search_index_en,search_index_es
yoodli-ai,Yoodli AI,[TRANSLATE-es] Yoodli AI,"Refine speech with AI: real-time feedback, personalized analytics, private improvement.…","[TRANSLATE-es] Refine speech with AI: real-time feedback, personalized analytics, private improvement.…",personal-assistant,other,Information not available,[TRANSLATE-es] Information not available,https://www.futurepedia.io/api/og?title=Yoodli+AI+Reviews%3A+Use+Cases%2C+Pricing+%26+Alternatives&image=https%3A%2F%2Fcdn.futurepedia.io%2F4c0871d865b637a4b8483ce768b1c65c80285eb4-1680x876.png,https://www.linkedin.com/company/yoodli/,,[TRANSLATE-es] ,"yoodli ai refine speech with ai: real-time feedback, personalized analytics, private improvement. ","yoodli ia refine speech with ia: real-time feedback, personalized analytics, private improvement. "
rewind-ai,Rewind,[TRANSLATE-es] Rewind,"Capture, transcribe, summarize digital interactions; enhance memory, privacy-focused.…","[TRANSLATE-es] Capture, transcribe, summarize digital interactions; enhance memory, privacy-focused.…",personal-assistant,other,Information not available,[TRANSLATE-es] Information not available,https://www.futurepedia.io/api/og?title=Rewind+AI+Reviews%3A+Use+Cases%2C+Pricing+%26+Alternatives&image=https%3A%2F%2Fcdn.futurepedia.io%2F36b62a5d8ef5124c9766bb5c4bf16116f31bd956-1728x951.jpg,https://twitter.com/RewindAI,,[TRANSLATE-es] ,"rewind capture, transcribe, summarize digital interactions; enhance memory, privacy-focused. ","rewind capture, transcribe, summarize digital interactions; enhance memory, privacy-focused. "
echowin,echowin,[TRANSLATE-es] echowin,AI-powered receptionist revolutionizes 24/7 multilingual customer interactions.…,[TRANSLATE-es] AI-powered receptionist revolutionizes 24/7 multilingual customer interactions.…,personal-assistant,other,Information not available,[TRANSLATE-es] Information not available,https://www.futurepedia.io/api/og?title=echowin+AI+Reviews%3A+Use+Cases%2C+Pricing+%26+Alternatives&image=https%3A%2F%2Fcdn.futurepedia.io%2F2025-01-13T19-56-31.170Z-LConKaw2Ateqq-nqIiGfVv4CTOJrUu2oo.PNG,https://tally.so/r/nWEKPQ,,[TRANSLATE-es] ,echowin ai-powered receptionist revolutionizes 24/7 multilingual customer interactions. ,echowin ia-powered receptionist revolutionizes 24/7 multilingual customer interactions. 
resume-worded,Resume Worded,[TRANSLATE-es] Resume Worded,"Boost your resume and LinkedIn with AI-driven, recruiter-approved feedback for 5x more interviews.…","[TRANSLATE-es] Boost your resume and LinkedIn with AI-driven, recruiter-approved feedback for 5x more interviews.…",personal-assistant,other,Information not available,[TRANSLATE-es] Information not available,https://www.futurepedia.io/api/og?title=Resume+Worded+AI+Reviews%3A+Use+Cases%2C+Pricing+%26+Alternatives&image=https%3A%2F%2Fcdn.futurepedia.io%2Fb27e1cf4b099ab280d5dce5c185d13839885adfa-1888x908.jpg,https://eesel.ai/?via=fp,,[TRANSLATE-es] ,"resume worded boost your resume and linkedin with ai-driven, recruiter-approved feedback for 5x more interviews. ","resume worded boost your resume and linkedin with ia-driven, recruiter-approved feedback for 5x more interviews. "
iapply,iApply,[TRANSLATE-es] iApply,Streamlines job applications with AI-driven resume optimization.…,[TRANSLATE-es] Streamlines job applications with AI-driven resume optimization.…,personal-assistant,other,Information not available,[TRANSLATE-es] Information not available,https://www.futurepedia.io/api/og?title=iApply+AI+Reviews%3A+Use+Cases%2C+Pricing+%26+Alternatives&image=https%3A%2F%2Fcdn.futurepedia.io%2F2025-02-01T03-45-29.178Z-mYAlWtfP80fGfDCp2S9ezkdsNyHorNZAd.PNG,https://eesel.ai/?via=fp,,[TRANSLATE-es] ,iapply streamlines job applications with ai-driven resume optimization. ,iapply streamlines job applications with ia-driven resume optimization. 
fireflies-ai,Fireflies.ai,[TRANSLATE-es] Fireflies.ai,"AI-driven transcription, summarization, and meeting management tool.…","[TRANSLATE-es] AI-driven transcription, summarization, and meeting management tool.…",personal-assistant,other,Information not available,[TRANSLATE-es] Information not available,https://www.futurepedia.io/api/og?title=Fireflies.ai+Reviews%3A+Use+Cases%2C+Pricing+%26+Alternatives&image=https%3A%2F%2Fcdn.futurepedia.io%2F987ec2c9e43534a084ffb8029a4c13804bafe103-2521x1302.png,https://www.producthunt.com/posts/askfred-from-fireflies-ai?utm_source=badge-featured&utm_medium=badge&utm_souce=badge-askfred-from-fireflies-ai,,[TRANSLATE-es] ,"fireflies.ai ai-driven transcription, summarization, and meeting management tool. ","fireflies.ia ia-driven transcription, summarization, and meeting management herramienta. "
resumetrick,ResumeTrick,[TRANSLATE-es] ResumeTrick,Revolutionize your resume creation with AI-powered efficiency and professional flair.…,[TRANSLATE-es] Revolutionize your resume creation with AI-powered efficiency and professional flair.…,personal-assistant,other,Information not available,[TRANSLATE-es] Information not available,https://www.futurepedia.io/api/og?title=ResumeTrick+AI+Reviews%3A+Use+Cases%2C+Pricing+%26+Alternatives&image=https%3A%2F%2Fcdn.futurepedia.io%2F698802f667095d719adc3e129e0ec55064eab349-2536x1254.jpg,https://twitter.com/resumetrick,,[TRANSLATE-es] ,resumetrick revolutionize your resume creation with ai-powered efficiency and professional flair. ,resumetrick revolutionize your resume creation with ia-powered efficiency and professional fliar. 
replika,Replika,[TRANSLATE-es] Replika,"AI companion for personalized chat, emotional support, and self-growth.…","[TRANSLATE-es] AI companion for personalized chat, emotional support, and self-growth.…",personal-assistant,assistant,Information not available,[TRANSLATE-es] Information not available,https://www.futurepedia.io/api/og?title=Replika+AI+Reviews%3A+Use+Cases%2C+Pricing+%26+Alternatives&image=https%3A%2F%2Fcdn.futurepedia.io%2F522e075fe76fafba6aa54f62ae710893169652e6-1846x937.jpg,https://www.facebook.com/groups/replikabeta/,,[TRANSLATE-es] ,"replika ai companion for personalized chat, emotional support, and self-growth. ","replika ia companion for personalized chat, emotional support, and self-growth. "
supermanage-ai,Supermanage AI,[TRANSLATE-es] Supermanage AI,Transform team management with AI-driven insights and automation.…,[TRANSLATE-es] Transform team management with AI-driven insights and automation.…,personal-assistant,other,Information not available,[TRANSLATE-es] Information not available,https://www.futurepedia.io/api/og?title=Supermanage+AI+Reviews%3A+Use+Cases%2C+Pricing+%26+Alternatives&image=https%3A%2F%2Fcdn.futurepedia.io%2F2025-01-13T19-34-26.405Z-9Wf2rgD02l9NKVkVXFKCALzFrd4f1dcML.PNG,https://eesel.ai/?via=fp,,[TRANSLATE-es] ,supermanage ai transform team management with ai-driven insights and automation. ,supermanage ia transform team management with ia-driven insights and automation. 
heyday,Heyday,[TRANSLATE-es] Heyday,"Revolutionize data management: AI-driven summarization, recall, and content creation.…","[TRANSLATE-es] Revolutionize data management: AI-driven summarization, recall, and content creation.…",personal-assistant,other,Information not available,[TRANSLATE-es] Information not available,https://www.futurepedia.io/api/og?title=Heyday+AI+Reviews%3A+Use+Cases%2C+Pricing+%26+Alternatives&image=https%3A%2F%2Fcdn.futurepedia.io%2F547355234b9631e28f7569e947f098e0517ea0cd-1796x902.jpg,https://twitter.com/heyday_hq,,[TRANSLATE-es] ,"heyday revolutionize data management: ai-driven summarization, recall, and content creation. ","heyday revolutionize data management: ia-driven summarization, recall, and content creation. "
traivl,Traivl,[TRANSLATE-es] Traivl,"Revolutionize travel planning with AI, local insights, and secure bookings.…","[TRANSLATE-es] Revolutionize travel planning with AI, local insights, and secure bookings.…",personal-assistant,other,Information not available,[TRANSLATE-es] Information not available,https://www.futurepedia.io/api/og?title=Traivl+AI+Reviews%3A+Use+Cases%2C+Pricing+%26+Alternatives&image=https%3A%2F%2Fcdn.futurepedia.io%2F1de8df402c38dcf406bdba89806b5aff0ac123e0-2501x1237.png,https://tally.so/r/nWEKPQ,,[TRANSLATE-es] ,"traivl revolutionize travel planning with ai, local insights, and secure bookings. ","triavl revolutionize travel planning with ia, local insights, and secure bookings. "
notyai,Noty.ai,[TRANSLATE-es] Noty.ai,"AI-driven tool transcribes, summarizes, and organizes meeting tasks.…","[TRANSLATE-es] AI-driven tool transcribes, summarizes, and organizes meeting tasks.…",personal-assistant,other,Information not available,[TRANSLATE-es] Information not available,https://www.futurepedia.io/api/og?title=Noty.ai+Reviews%3A+Use+Cases%2C+Pricing+%26+Alternatives&image=https%3A%2F%2Fcdn.futurepedia.io%2F2025-01-27T05-32-24.343Z-GJ9HbrWAETLmL9wIe51OwrqH_9sm0jqOo.PNG,https://www.descript.com?lmref=wVa-qw,,[TRANSLATE-es] ,"noty.ai ai-driven tool transcribes, summarizes, and organizes meeting tasks. ","noty.ia ia-driven herramienta transcribes, summarizes, and organizes meeting tasks. "
vacay,Vacay,[TRANSLATE-es] Vacay,AI-driven travel planning with personalized itineraries and global insights.…,[TRANSLATE-es] AI-driven travel planning with personalized itineraries and global insights.…,personal-assistant,other,Information not available,[TRANSLATE-es] Information not available,https://www.futurepedia.io/api/og?title=Vacay+AI+Reviews%3A+Use+Cases%2C+Pricing+%26+Alternatives&image=https%3A%2F%2Fcdn.futurepedia.io%2F9ea24496fd14e37c31aa94d5b55b6d10f8a5e426-2880x1592.png,https://tally.so/r/nWEKPQ,,[TRANSLATE-es] ,vacay ai-driven travel planning with personalized itineraries and global insights. ,vacay ia-driven travel planning with personalized itineraries and global insights. 
pathfinder,Pathfinder,[TRANSLATE-es] Pathfinder,"Harness AI for tailored life strategies; evolve goals, boost productivity, enhance relationships.…","[TRANSLATE-es] Harness AI for tailored life strategies; evolve goals, boost productivity, enhance relationships.…",personal-assistant,research,Information not available,[TRANSLATE-es] Information not available,https://www.futurepedia.io/api/og?title=Pathfinder+AI+Reviews%3A+Use+Cases%2C+Pricing+%26+Alternatives&image=https%3A%2F%2Fcdn.futurepedia.io%2Fd6fc8a31850ae3e50246b6956669192376648f77-2560x1269.jpg,https://tally.so/r/nWEKPQ,,[TRANSLATE-es] ,"pathfinder harness ai for tailored life strategies; evolve goals, boost productivity, enhance relationships. ","pathfinder harness ia for tialored life strategies; evolve goals, boost productivity, enhance relationships. "
docus,Docus,[TRANSLATE-es] Docus,AI-driven health platform for personalized insights and expert advice.…,[TRANSLATE-es] AI-driven health platform for personalized insights and expert advice.…,personal-assistant,other,Information not available,[TRANSLATE-es] Information not available,https://www.futurepedia.io/api/og?title=Docus+AI+Reviews%3A+Use+Cases%2C+Pricing+%26+Alternatives&image=https%3A%2F%2Fcdn.futurepedia.io%2F6eb2bfd2495c6311adc7226bdd772899d4b62e95-2532x1259.jpg,https://twitter.com/docus_ai,,[TRANSLATE-es] ,docus ai-driven health platform for personalized insights and expert advice. ,docus ia-driven health platform for personalized insights and expert advice. 
caktus,Caktus,[TRANSLATE-es] Caktus,Revolutionize content creation and data analysis with AI-driven precision and personalization.…,[TRANSLATE-es] Revolutionize content creation and data analysis with AI-driven precision and personalization.…,personal-assistant,other,Information not available,[TRANSLATE-es] Information not available,https://www.futurepedia.io/api/og?title=Caktus+AI+Reviews%3A+Use+Cases%2C+Pricing+%26+Alternatives&image=https%3A%2F%2Fcdn.futurepedia.io%2F7ea6fbb44ad13a6f848cf236c1a402f9b5755ec5-2521x1236.png,https://tally.so/r/nWEKPQ,,[TRANSLATE-es] ,caktus revolutionize content creation and data analysis with ai-driven precision and personalization. ,caktus revolutionize content creation and data analysis with ia-driven precision and personalization. 
addy-ai,Addy AI,[TRANSLATE-es] Addy AI,"Revolutionizes email management with AI, prioritizing, summarizing, and composing effortlessly.…","[TRANSLATE-es] Revolutionizes email management with AI, prioritizing, summarizing, and composing effortlessly.…",personal-assistant,other,Information not available,[TRANSLATE-es] Information not available,https://www.futurepedia.io/api/og?title=Addy+AI+Reviews%3A+Use+Cases%2C+Pricing+%26+Alternatives&image=https%3A%2F%2Fcdn.futurepedia.io%2F83f6b0fe4cdf7d6e681a9529935feef4d738d19d-1878x876.png,https://tally.so/r/nWEKPQ,,[TRANSLATE-es] ,"addy ai revolutionizes email management with ai, prioritizing, summarizing, and composing effortlessly. ","addy ia revolutionizes emial management with ia, prioritizing, summarizing, and composing effortlessly. "
summit,Summit,[TRANSLATE-es] Summit,"AI-powered life coach that helps you achieve your goals by accelerating habits, providing accountability, and offering personalization.…","[TRANSLATE-es] AI-powered life coach that helps you achieve your goals by accelerating habits, providing accountability, and offering personalization.…",personal-assistant,other,Information not available,[TRANSLATE-es] Information not available,https://www.futurepedia.io/api/og?title=Summit+AI+Reviews%3A+Use+Cases%2C+Pricing+%26+Alternatives&image=https%3A%2F%2Fcdn.futurepedia.io%2F89b55c6ee09ce0cebe55acf0e178275b04d0c498-2534x1261.jpg,https://discord.com/invite/JdVSPMqN5E,,[TRANSLATE-es] ,"summit ai-powered life coach that helps you achieve your goals by accelerating habits, providing accountability, and offering personalization. ","summit ia-powered life coach that helps you achieve your goals by accelerating habits, providing accountability, and offering personalization. "
linerai,Liner.ai,[TRANSLATE-es] Liner.ai,"Unlock machine learning: code-free, end-to-end, fast, and accessible to all.…","[TRANSLATE-es] Unlock machine learning: code-free, end-to-end, fast, and accessible to all.…",personal-assistant,code,Information not available,[TRANSLATE-es] Information not available,https://www.futurepedia.io/api/og?title=Liner.ai+Reviews%3A+Use+Cases%2C+Pricing+%26+Alternatives&image=https%3A%2F%2Fcdn.futurepedia.io%2Fdc67e1e2d2deea440a6748bba02e4f3ec30f581d-1920x977.png,https://www.youtube.com/watch?v=dtA9cBC5Bw0,,[TRANSLATE-es] ,"liner.ai unlock machine learning: code-free, end-to-end, fast, and accessible to all. ","liner.ia unlock machine learning: codigo-free, end-to-end, fast, and accessible to all. "
glimpse,Glimpse,[TRANSLATE-es] Glimpse,AI-powered browser extension enhancing browsing with tailored insights.…,[TRANSLATE-es] AI-powered browser extension enhancing browsing with tailored insights.…,personal-assistant,other,Information not available,[TRANSLATE-es] Information not available,https://www.futurepedia.io/api/og?title=Glimpse+AI+Reviews%3A+Use+Cases%2C+Pricing+%26+Alternatives&image=https%3A%2F%2Fcdn.futurepedia.io%2F2025-02-01T03-39-14.578Z-FgFppK2P1dEbFr9nxbko1e1Zambb-rTaM.PNG,https://tally.so/r/nWEKPQ,,[TRANSLATE-es] ,glimpse ai-powered browser extension enhancing browsing with tailored insights. ,glimpse ia-powered browser extension enhancing browsing with tialored insights. 
personalai,Personal AI,[TRANSLATE-es] Personal AI,"Revolutionize workflows with customizable, secure AI personas integration.…","[TRANSLATE-es] Revolutionize workflows with customizable, secure AI personas integration.…",personal-assistant,other,Information not available,[TRANSLATE-es] Information not available,https://www.futurepedia.io/api/og?title=Personal+AI+Reviews%3A+Use+Cases%2C+Pricing+%26+Alternatives&image=https%3A%2F%2Fcdn.futurepedia.io%2F2025-01-27T05-36-29.306Z-uLQsgn079VOdb0WARefW_57um9S1GTUIv.PNG,https://www.facebook.com/personalai,,[TRANSLATE-es] ,"personal ai revolutionize workflows with customizable, secure ai personas integration. ","personal ia revolutionize workflows with customizable, secure ia personas integration. "
tuliaa,Tuliaa,[TRANSLATE-es] Tuliaa,"Elevate content creation with AI-driven writing, SEO optimization, and intuitive design.…","[TRANSLATE-es] Elevate content creation with AI-driven writing, SEO optimization, and intuitive design.…",personal-assistant,writing,Information not available,[TRANSLATE-es] Information not available,https://www.futurepedia.io/api/og?title=Tuliaa+AI+Reviews%3A+Use+Cases%2C+Pricing+%26+Alternatives&image=https%3A%2F%2Fcdn.futurepedia.io%2Fb73f40e362c90dc8930ccdb742cacbb75c67c762-1920x853.png,https://tally.so/r/nWEKPQ,,[TRANSLATE-es] ,"tuliaa elevate content creation with ai-driven writing, seo optimization, and intuitive design. ","tuliaa elevate content creation with ia-driven escritura, seo optimization, and intuitive design. "
typingmind,TypingMind,[TRANSLATE-es] TypingMind,"Enhance ChatGPT interaction with intuitive UI, conversation management, and customization.…","[TRANSLATE-es] Enhance ChatGPT interaction with intuitive UI, conversation management, and customization.…",personal-assistant,assistant,Information not available,[TRANSLATE-es] Information not available,https://www.futurepedia.io/api/og?title=TypingMind+AI+Reviews%3A+Use+Cases%2C+Pricing+%26+Alternatives&image=https%3A%2F%2Fcdn.futurepedia.io%2Fc0b9f7e1e6f9e1bd9bfccd2df4b45099dd9400bf-1893x920.png,https://tally.so/r/nWEKPQ,,[TRANSLATE-es] ,"typingmind enhance chatgpt interaction with intuitive ui, conversation management, and customization. ","typingmind enhance chatgpt interaction with intuitive ui, conversation management, and customization. "
circlebackai,Circleback.ai,[TRANSLATE-es] Circleback.ai,"Streamline meeting notes and action items with AI, ensuring efficiency and data security.…","[TRANSLATE-es] Streamline meeting notes and action items with AI, ensuring efficiency and data security.…",personal-assistant,other,Information not available,[TRANSLATE-es] Information not available,https://www.futurepedia.io/api/og?title=Circleback.ai+Reviews%3A+Use+Cases%2C+Pricing+%26+Alternatives&image=https%3A%2F%2Fcdn.futurepedia.io%2F1f1992a9b5a7348e287b546aaaaefabc5052df39-1366x768.png,https://twitter.com/circlebackai,,[TRANSLATE-es] ,"circleback.ai streamline meeting notes and action items with ai, ensuring efficiency and data security. ","circleback.ia streamline meeting notes and action items with ia, ensuring efficiency and data security. "
olympia,Olympia,[TRANSLATE-es] Olympia,"AI consultants simplify business tasks, enhance productivity, cut costs.…","[TRANSLATE-es] AI consultants simplify business tasks, enhance productivity, cut costs.…",personal-assistant,other,Information not available,[TRANSLATE-es] Information not available,https://www.futurepedia.io/api/og?title=Olympia+AI+Reviews%3A+Use+Cases%2C+Pricing+%26+Alternatives&image=https%3A%2F%2Fcdn.futurepedia.io%2F303aed19d844ee0e01e4ad7e4848c4c90ac7f1bd-1893x917.png,https://x.com/OlympiaChat,,[TRANSLATE-es] ,"olympia ai consultants simplify business tasks, enhance productivity, cut costs. ","olympia ia consultants simplify business tasks, enhance productivity, cut costs. "
spoke,Spoke.ai,[TRANSLATE-es] Spoke.ai,AI-powered tool revolutionizes team communication and project management.…,[TRANSLATE-es] AI-powered tool revolutionizes team communication and project management.…,personal-assistant,other,Information not available,[TRANSLATE-es] Information not available,https://www.futurepedia.io/api/og?title=Spoke.ai+Reviews%3A+Use+Cases%2C+Pricing+%26+Alternatives&image=https%3A%2F%2Fcdn.futurepedia.io%2Fdc8b917eabe721cc552106fbda17b34b9f3747a6-3000x1461.jpg,https://soofy.io/index/ref?&r=1674589108949x536014008447273100,,[TRANSLATE-es] ,spoke.ai ai-powered tool revolutionizes team communication and project management. ,spoke.ia ia-powered herramienta revolutionizes team communication and project management. 
torq,Torq,[TRANSLATE-es] Torq,"Boost productivity with AI-driven task automation, prioritization, and seamless app integration.…","[TRANSLATE-es] Boost productivity with AI-driven task automation, prioritization, and seamless app integration.…",personal-assistant,other,Information not available,[TRANSLATE-es] Information not available,https://www.futurepedia.io/api/og?title=Torq+AI+Reviews%3A+Use+Cases%2C+Pricing+%26+Alternatives&image=https%3A%2F%2Fcdn.futurepedia.io%2Ff117a13a8ac294b3175758eaedc59cf0b2a71e3b-2517x1266.jpg,https://www.linkedin.com/company/torq-ai/,,[TRANSLATE-es] ,"torq boost productivity with ai-driven task automation, prioritization, and seamless app integration. ","torq boost productivity with ia-driven task automation, prioritization, and seamless app integration. "
pi,Pi,[TRANSLATE-es] Pi,"AI-powered conversational assistant offering personalized, context-aware interactions.…","[TRANSLATE-es] AI-powered conversational assistant offering personalized, context-aware interactions.…",personal-assistant,assistant,Information not available,[TRANSLATE-es] Information not available,https://www.futurepedia.io/api/og?title=Pi+AI+Reviews%3A+Use+Cases%2C+Pricing+%26+Alternatives&image=https%3A%2F%2Fcdn.futurepedia.io%2F2025-01-27T21-54-34.209Z-FjI2-ct9K4YCxDYlmqHRuR8ksE4EawnO6.PNG,https://tally.so/r/nWEKPQ,,[TRANSLATE-es] ,"pi ai-powered conversational assistant offering personalized, context-aware interactions. ","pi ia-powered conversational asistente offering personalized, context-aware interactions. "
penny-ai,Penny AI,[TRANSLATE-es] Penny AI,Maximize savings with AI-driven price comparisons and insightful product analyses.…,[TRANSLATE-es] Maximize savings with AI-driven price comparisons and insightful product analyses.…,personal-assistant,other,Information not available,[TRANSLATE-es] Information not available,https://www.futurepedia.io/api/og?title=Penny+AI+Reviews%3A+Use+Cases%2C+Pricing+%26+Alternatives&image=https%3A%2F%2Fcdn.futurepedia.io%2Ffd43373d8813616c1ab97c8511258e1d929b0380-2528x1252.png,https://www.magicform.ai/?via=Futurepedia,,[TRANSLATE-es] ,penny ai maximize savings with ai-driven price comparisons and insightful product analyses. ,penny ia maximize savings with ia-driven price comparisons and insightful product analyses. 
noowai,NoowAI,[TRANSLATE-es] NoowAI,Multilingual AI assistant enhancing productivity with user-friendly resources.…,[TRANSLATE-es] Multilingual AI assistant enhancing productivity with user-friendly resources.…,personal-assistant,assistant,Information not available,[TRANSLATE-es] Information not available,https://www.futurepedia.io/api/og?title=NoowAI+Reviews%3A+Use+Cases%2C+Pricing+%26+Alternatives&image=https%3A%2F%2Fcdn.futurepedia.io%2F22966b323b5f7bdb5d56573eb0626113cb8df597-2458x1262.jpg,https://www.facebook.com/noowai.global/,,[TRANSLATE-es] ,noowai multilingual ai assistant enhancing productivity with user-friendly resources. ,noowia multilingual ia asistente enhancing productivity with user-friendly resources. 
mumble-note,Mumble Note,[TRANSLATE-es] Mumble Note,Transforms spoken words into structured notes instantly.…,[TRANSLATE-es] Transforms spoken words into structured notes instantly.…,personal-assistant,other,Information not available,[TRANSLATE-es] Information not available,https://www.futurepedia.io/api/og?title=Mumble+Note+AI+Reviews%3A+Use+Cases%2C+Pricing+%26+Alternatives&image=https%3A%2F%2Fcdn.futurepedia.io%2F2025-06-10T14-44-50.545Z-yke4HAOYMd55FhKgfMHiW6RY8ZS4BZYRf.blob,https://x.com/mumblenote,,[TRANSLATE-es] ,mumble note transforms spoken words into structured notes instantly. ,mumble note transforms spoken words into structured notes instantly. 
taiga,Taiga,[TRANSLATE-es] Taiga,Open-source tool for agile project management and collaboration.…,[TRANSLATE-es] Open-source tool for agile project management and collaboration.…,personal-assistant,other,Information not available,[TRANSLATE-es] Information not available,https://www.futurepedia.io/api/og?title=Taiga+AI+Reviews%3A+Use+Cases%2C+Pricing+%26+Alternatives&image=https%3A%2F%2Fcdn.futurepedia.io%2F8077fe1782d0cbdebbbfb4c1003a465df5dfba91-2531x1267.jpg,https://monica.im/invitation-affiliate?ref=yzawntq&ref_aff=yzawntq,,[TRANSLATE-es] ,taiga open-source tool for agile project management and collaboration. ,tiaga open-source herramienta for agile project management and collaboration. 
rizemail,Rizemail,[TRANSLATE-es] Rizemail,"Streamline email management with AI-powered, secure, and integrated inbox summarization.…","[TRANSLATE-es] Streamline email management with AI-powered, secure, and integrated inbox summarization.…",personal-assistant,other,Information not available,[TRANSLATE-es] Information not available,https://www.futurepedia.io/api/og?title=Rizemail+AI+Reviews%3A+Use+Cases%2C+Pricing+%26+Alternatives&image=https%3A%2F%2Fcdn.futurepedia.io%2F87e9f6aaa755bce468492ba997271706f28674b5-1897x922.png,https://tally.so/r/nWEKPQ,,[TRANSLATE-es] ,"rizemail streamline email management with ai-powered, secure, and integrated inbox summarization. ","rizemial streamline emial management with ia-powered, secure, and integrated inbox summarization. "
