slug,title_en,title_es,short_description_en,short_description_es,category,app_type,pricing_en,pricing_es,image_url,redirect_url,tags_en,tags_es,search_index_en,search_index_es
crystalsound,CrystalSound,[TRANSLATE-es] CrystalSound,Enhance virtual meetings with AI-driven noise cancellation.…,[TRANSLATE-es] Enhance virtual meetings with AI-driven noise cancellation.…,personal-assistant,audio,Information not available,[TRANSLATE-es] Information not available,https://www.futurepedia.io/api/og?title=CrystalSound+AI+Reviews%3A+Use+Cases%2C+Pricing+%26+Alternatives&image=https%3A%2F%2Fcdn.futurepedia.io%2F2025-01-27T01-26-17.278Z-AMGa1kXpAE1IlLJuX5zb3ARMK1ZgENvD7.PNG,https://www.youtube.com/watch?v=ZmWobZkL4_E&feature=youtu.be,,[TRANSLATE-es] ,crystalsound enhance virtual meetings with ai-driven noise cancellation. ,crystalsound enhance virtual meetings with ia-driven noise cancellation. 
nexus-clay,Nexus - Clay,[TRANSLATE-es] Nexus - Clay,AI-driven relationship manager automating and enhancing your networking.…,[TRANSLATE-es] AI-driven relationship manager automating and enhancing your networking.…,personal-assistant,other,Information not available,[TRANSLATE-es] Information not available,https://www.futurepedia.io/api/og?title=Nexus+-+Clay+AI+Reviews%3A+Use+Cases%2C+Pricing+%26+Alternatives&image=https%3A%2F%2Fcdn.futurepedia.io%2F7ad37722cf8a446cfae71e040bb422690fdf7d91-2378x1266.jpg,https://twitter.com/ClayHQ,,[TRANSLATE-es] ,nexus - clay ai-driven relationship manager automating and enhancing your networking. ,nexus - clay ia-driven relationship manager automating and enhancing your networking. 
accountabilabuddy,Accountabilabuddy,[TRANSLATE-es] Accountabilabuddy,AI-driven life coach for personalized goal achievement and tracking.…,[TRANSLATE-es] AI-driven life coach for personalized goal achievement and tracking.…,personal-assistant,other,Information not available,[TRANSLATE-es] Information not available,https://www.futurepedia.io/api/og?title=Accountabilabuddy+AI+Reviews%3A+Use+Cases%2C+Pricing+%26+Alternatives&image=https%3A%2F%2Fcdn.futurepedia.io%2F63fdcc890fbd4403aedd509177ebc553819fc8b1-2560x1255.jpg,https://tally.so/r/nWEKPQ,,[TRANSLATE-es] ,accountabilabuddy ai-driven life coach for personalized goal achievement and tracking. ,accountabilabuddy ia-driven life coach for personalized goal achievement and tracking. 
glass-it-price-tracker,Glass It Price Tracker,[TRANSLATE-es] Glass It Price Tracker,AI-driven tool for real-time price alerts and tracking.…,[TRANSLATE-es] AI-driven tool for real-time price alerts and tracking.…,personal-assistant,other,Information not available,[TRANSLATE-es] Information not available,https://www.futurepedia.io/api/og?title=Glass+It+Price+Tracker+AI+Reviews%3A+Use+Cases%2C+Pricing+%26+Alternatives&image=https%3A%2F%2Fcdn.futurepedia.io%2F2025-02-01T03-37-25.866Z-y3FPUgCHbiSVqCWLHa4NYj-ztK9Cc4gcm.PNG,https://www.facebook.com/GlassItLLC,,[TRANSLATE-es] ,glass it price tracker ai-driven tool for real-time price alerts and tracking. ,glass it price tracker ia-driven herramienta for real-time price alerts and tracking. 
mailmaestro,MailMaestro,[TRANSLATE-es] MailMaestro,Boost email drafting speed and security with AI-driven personalization.…,[TRANSLATE-es] Boost email drafting speed and security with AI-driven personalization.…,personal-assistant,other,Information not available,[TRANSLATE-es] Information not available,https://www.futurepedia.io/api/og?title=MailMaestro+AI+Reviews%3A+Use+Cases%2C+Pricing+%26+Alternatives&image=https%3A%2F%2Fcdn.futurepedia.io%2Fba5b466d59769c6dd32d423d55a6715f0267d3a1-2513x1230.png,https://www.linkedin.com/company/maestrolabs/,,[TRANSLATE-es] ,mailmaestro boost email drafting speed and security with ai-driven personalization. ,mialmaestro boost emial drafting speed and security with ia-driven personalization. 
tailor,Tailor,[TRANSLATE-es] Tailor,"Revolutionizes news consumption with AI-driven, personalized daily summaries.…","[TRANSLATE-es] Revolutionizes news consumption with AI-driven, personalized daily summaries.…",personal-assistant,other,Information not available,[TRANSLATE-es] Information not available,https://www.futurepedia.io/api/og?title=Tailor+AI+Reviews%3A+Use+Cases%2C+Pricing+%26+Alternatives&image=https%3A%2F%2Fcdn.futurepedia.io%2F4b9e28a1bc10de1fbdb3fe053f65cba0d3eaff65-2524x1298.png,https://www.youtube.com/shorts/zyc-FQL82mE,,[TRANSLATE-es] ,"tailor revolutionizes news consumption with ai-driven, personalized daily summaries. ","tialor revolutionizes news consumption with ia-driven, personalized dialy summaries. "
aiapply,AIApply,[TRANSLATE-es] AIApply,AI-powered platform automates job applications and interview prep.…,[TRANSLATE-es] AI-powered platform automates job applications and interview prep.…,personal-assistant,other,Information not available,[TRANSLATE-es] Information not available,https://www.futurepedia.io/api/og?title=AIApply+AI+Reviews%3A+Use+Cases%2C+Pricing+%26+Alternatives&image=https%3A%2F%2Fcdn.futurepedia.io%2F2025-02-02T11-35-07.810Z-uXxmhCH-Gdqd_9s90G_AEFCumaVnHdbFe.PNG,https://www.facebook.com/aiapply.co/,,[TRANSLATE-es] ,aiapply ai-powered platform automates job applications and interview prep. ,iaapply ia-powered platform automates job applications and interview prep. 
flot-ai,Flot AI,[TRANSLATE-es] Flot AI,"AI tool enhances writing, reading, and memorization efficiency.…","[TRANSLATE-es] AI tool enhances writing, reading, and memorization efficiency.…",personal-assistant,writing,Information not available,[TRANSLATE-es] Information not available,https://www.futurepedia.io/api/og?title=Flot+AI+Reviews%3A+Use+Cases%2C+Pricing+%26+Alternatives&image=https%3A%2F%2Fcdn.futurepedia.io%2Ff5a8e362f6f44be8b47363e58786a404beb1e500-1200x600.jpg,https://monica.im/invitation-affiliate?ref=yzawntq&ref_aff=yzawntq,,[TRANSLATE-es] ,"flot ai ai tool enhances writing, reading, and memorization efficiency. ","flot ia ia herramienta enhances escritura, reading, and memorization efficiency. "
travel-plan-ai,Travel Plan AI,[TRANSLATE-es] Travel Plan AI,"Streamline travel planning with AI-generated, customizable itineraries.…","[TRANSLATE-es] Streamline travel planning with AI-generated, customizable itineraries.…",personal-assistant,generator,Information not available,[TRANSLATE-es] Information not available,https://www.futurepedia.io/api/og?title=Travel+Plan+AI+Reviews%3A+Use+Cases%2C+Pricing+%26+Alternatives&image=https%3A%2F%2Fcdn.futurepedia.io%2F814f7b94238af89a5f46e8f9ffa8ed9018958bd4-1891x878.png,https://tally.so/r/nWEKPQ,,[TRANSLATE-es] ,"travel plan ai streamline travel planning with ai-generated, customizable itineraries. ","travel plan ia streamline travel planning with ia-generated, customizable itineraries. "
insummary,InSummary,[TRANSLATE-es] InSummary,"AI-powered tool delivering non-intrusive, real-time productivity insights.…","[TRANSLATE-es] AI-powered tool delivering non-intrusive, real-time productivity insights.…",personal-assistant,other,Information not available,[TRANSLATE-es] Information not available,https://www.futurepedia.io/api/og?title=InSummary+AI+Reviews%3A+Use+Cases%2C+Pricing+%26+Alternatives&image=https%3A%2F%2Fcdn.futurepedia.io%2F2025-02-02T12-06-50.104Z-JzevyV8n4_t_rbvqw7b5aZzDdSRTTLTIp.PNG,https://tally.so/r/nWEKPQ,,[TRANSLATE-es] ,"insummary ai-powered tool delivering non-intrusive, real-time productivity insights. ","insummary ia-powered herramienta delivering non-intrusive, real-time productivity insights. "
mymemo-ai,MyMemo AI,[TRANSLATE-es] MyMemo AI,"Transform digital chaos into an organized, AI-enhanced knowledge oasis.…","[TRANSLATE-es] Transform digital chaos into an organized, AI-enhanced knowledge oasis.…",personal-assistant,other,Information not available,[TRANSLATE-es] Information not available,https://www.futurepedia.io/api/og?title=MyMemo+AI+Reviews%3A+Use+Cases%2C+Pricing+%26+Alternatives&image=https%3A%2F%2Fcdn.futurepedia.io%2Fcf7d237d19fb3ef443e067dacab504748c1f08bb-2492x1223.png,https://twitter.com/MyMemoAI,,[TRANSLATE-es] ,"mymemo ai transform digital chaos into an organized, ai-enhanced knowledge oasis. ","mymemo ia transform digital chaos into an organized, ia-enhanced knowledge oasis. "
shop-guru-ai,Shop Guru AI,[TRANSLATE-es] Shop Guru AI,AI assistant enhances Amazon shopping with review insights.…,[TRANSLATE-es] AI assistant enhances Amazon shopping with review insights.…,personal-assistant,assistant,Information not available,[TRANSLATE-es] Information not available,https://www.futurepedia.io/api/og?title=Shop+Guru+AI+Reviews%3A+Use+Cases%2C+Pricing+%26+Alternatives&image=https%3A%2F%2Fcdn.futurepedia.io%2Fe81b25569222bd5679c2da5957c9b1209d221d5a-2527x1255.jpg,https://twitter.com/turbismo,,[TRANSLATE-es] ,shop guru ai ai assistant enhances amazon shopping with review insights. ,shop guru ia ia asistente enhances amazon shopping with review insights. 
gymbuddy-ai,GymBuddy AI,[TRANSLATE-es] GymBuddy AI,AI-driven tool for personalized workout plans and progress tracking.…,[TRANSLATE-es] AI-driven tool for personalized workout plans and progress tracking.…,personal-assistant,other,Information not available,[TRANSLATE-es] Information not available,https://www.futurepedia.io/api/og?title=GymBuddy+AI+Reviews%3A+Use+Cases%2C+Pricing+%26+Alternatives&image=https%3A%2F%2Fcdn.futurepedia.io%2F625f59d9b992850494b260cadcac4576184bb3ac-2515x1208.jpg,https://tally.so/r/nWEKPQ,,[TRANSLATE-es] ,gymbuddy ai ai-driven tool for personalized workout plans and progress tracking. ,gymbuddy ia ia-driven herramienta for personalized workout plans and progress tracking. 
call-annie,Call Annie,[TRANSLATE-es] Call Annie,"Revolutionize communication with real-time, AI-driven conversational interactions.…","[TRANSLATE-es] Revolutionize communication with real-time, AI-driven conversational interactions.…",personal-assistant,other,Information not available,[TRANSLATE-es] Information not available,https://www.futurepedia.io/api/og?title=Call+Annie+AI+Reviews%3A+Use+Cases%2C+Pricing+%26+Alternatives&image=https%3A%2F%2Fcdn.futurepedia.io%2F2025-01-31T23-59-51.907Z-2cx8BSj2vQ_y8nbhd5l6wYnmWqptKkKsG.PNG,https://discord.com/invite/Rfbzet5R3v,,[TRANSLATE-es] ,"call annie revolutionize communication with real-time, ai-driven conversational interactions. ","call annie revolutionize communication with real-time, ia-driven conversational interactions. "
dream-decoder,Dream Decoder,[TRANSLATE-es] Dream Decoder,"Unlock your dreams: AI-powered, personalized, confidential dream interpretation.…","[TRANSLATE-es] Unlock your dreams: AI-powered, personalized, confidential dream interpretation.…",personal-assistant,code,Information not available,[TRANSLATE-es] Information not available,https://www.futurepedia.io/api/og?title=Dream+Decoder+AI+Reviews%3A+Use+Cases%2C+Pricing+%26+Alternatives&image=https%3A%2F%2Fcdn.futurepedia.io%2F5c1ffccea50ccbf2f2344293eac018b73ba05d61-2560x1265.jpg,https://tally.so/r/nWEKPQ,,[TRANSLATE-es] ,"dream decoder unlock your dreams: ai-powered, personalized, confidential dream interpretation. ","dream decodigor unlock your dreams: ia-powered, personalized, confidential dream interpretation. "
snapdress,SnapDress,[TRANSLATE-es] SnapDress,Transform your portrait photos with custom outfit ideas using SnapDress.…,[TRANSLATE-es] Transform your portrait photos with custom outfit ideas using SnapDress.…,personal-assistant,image,Information not available,[TRANSLATE-es] Information not available,https://www.futurepedia.io/api/og?title=SnapDress+AI+Reviews%3A+Use+Cases%2C+Pricing+%26+Alternatives&image=https%3A%2F%2Fcdn.futurepedia.io%2F13bbf7976006d18bda803b909e2b5d1ce22f3f1d-2556x1264.jpg,https://discord.com/invite/ND6TjtNFNT,,[TRANSLATE-es] ,snapdress transform your portrait photos with custom outfit ideas using snapdress. ,snapdress transform your portriat photos with custom outfit ideas using snapdress. 
plantrips,PlanTrips,[TRANSLATE-es] PlanTrips,"Revolutionizes travel planning with AI-generated, personalized itineraries quickly.…","[TRANSLATE-es] Revolutionizes travel planning with AI-generated, personalized itineraries quickly.…",personal-assistant,generator,Information not available,[TRANSLATE-es] Information not available,https://www.futurepedia.io/api/og?title=PlanTrips+AI+Reviews%3A+Use+Cases%2C+Pricing+%26+Alternatives&image=https%3A%2F%2Fcdn.futurepedia.io%2F2baf4362a4b6f7a470abab56425f8ee3c4fa5d22-2540x1269.jpg,https://tally.so/r/nWEKPQ,,[TRANSLATE-es] ,"plantrips revolutionizes travel planning with ai-generated, personalized itineraries quickly. ","plantrips revolutionizes travel planning with ia-generated, personalized itineraries quickly. "
taranify,Taranify,[TRANSLATE-es] Taranify,AI-driven tool aligns entertainment with your mood.…,[TRANSLATE-es] AI-driven tool aligns entertainment with your mood.…,personal-assistant,other,Information not available,[TRANSLATE-es] Information not available,https://www.futurepedia.io/api/og?title=Taranify+AI+Reviews%3A+Use+Cases%2C+Pricing+%26+Alternatives&image=https%3A%2F%2Fcdn.futurepedia.io%2F2025-01-06T12-54-15.558Z-6fLO_FTIvydJhNB_6bePEPTwrDcVW0hOu.PNG,https://twitter.com/taranify,,[TRANSLATE-es] ,taranify ai-driven tool aligns entertainment with your mood. ,taranify ia-driven herramienta aligns entertianment with your mood. 
beedone,BeeDone,[TRANSLATE-es] BeeDone,A Gamified Task Management App…,[TRANSLATE-es] A Gamified Task Management App…,personal-assistant,other,Information not available,[TRANSLATE-es] Information not available,https://www.futurepedia.io/api/og?title=BeeDone+AI+Reviews%3A+Use+Cases%2C+Pricing+%26+Alternatives&image=https%3A%2F%2Fcdn.futurepedia.io%2Fb194b67683f495651d06509196d540652dfad0a7-2519x1233.png,https://tally.so/r/nWEKPQ,,[TRANSLATE-es] ,beedone a gamified task management app ,beedone a gamified task management app 
travelnaut,Travelnaut,[TRANSLATE-es] Travelnaut,Unleash AI to tailor and simplify your travel planning journey.…,[TRANSLATE-es] Unleash AI to tailor and simplify your travel planning journey.…,personal-assistant,other,Information not available,[TRANSLATE-es] Information not available,https://www.futurepedia.io/api/og?title=Travelnaut+AI+Reviews%3A+Use+Cases%2C+Pricing+%26+Alternatives&image=https%3A%2F%2Fcdn.futurepedia.io%2Fece3d1a5e64bcb9d670894805a3744cf682adf64-2530x1238.png,https://www.instagram.com/travelnautcom,,[TRANSLATE-es] ,travelnaut unleash ai to tailor and simplify your travel planning journey. ,travelnaut unleash ia to tialor and simplify your travel planning journey. 
jobwizard,JobWizard,[TRANSLATE-es] JobWizard,Streamline job applications with AI-driven autofill and insights.…,[TRANSLATE-es] Streamline job applications with AI-driven autofill and insights.…,personal-assistant,other,Information not available,[TRANSLATE-es] Information not available,https://www.futurepedia.io/api/og?title=JobWizard+AI+Reviews%3A+Use+Cases%2C+Pricing+%26+Alternatives&image=https%3A%2F%2Fcdn.futurepedia.io%2F2025-01-06T12-44-55.997Z-ByeqPEUpfdN4EbcLcYXiptwv3x3q-_kjS.PNG,https://twitter.com/JobWizard_AI,,[TRANSLATE-es] ,jobwizard streamline job applications with ai-driven autofill and insights. ,jobwizard streamline job applications with ia-driven autofill and insights. 
gifthuntr,GiftHuntr,[TRANSLATE-es] GiftHuntr,"Revolutionize gift-giving with AI-driven, personalized suggestions.…","[TRANSLATE-es] Revolutionize gift-giving with AI-driven, personalized suggestions.…",personal-assistant,other,Information not available,[TRANSLATE-es] Information not available,https://www.futurepedia.io/api/og?title=GiftHuntr+AI+Reviews%3A+Use+Cases%2C+Pricing+%26+Alternatives&image=https%3A%2F%2Fcdn.futurepedia.io%2Fcd39c19ffaeac3c98876acf4bb6469c8041a6993-2469x1224.png,https://tally.so/r/nWEKPQ,,[TRANSLATE-es] ,"gifthuntr revolutionize gift-giving with ai-driven, personalized suggestions. ","gifthuntr revolutionize gift-giving with ia-driven, personalized suggestions. "
albertbro,AlbertBro,[TRANSLATE-es] AlbertBro,"Boost global communication with multilingual support, privacy, and ease of use.…","[TRANSLATE-es] Boost global communication with multilingual support, privacy, and ease of use.…",personal-assistant,other,Information not available,[TRANSLATE-es] Information not available,https://www.futurepedia.io/api/og?title=AlbertBro+AI+Reviews%3A+Use+Cases%2C+Pricing+%26+Alternatives&image=https%3A%2F%2Fcdn.futurepedia.io%2F9edad036682b86404476f0ee942236bd39b02682-2560x1255.jpg,https://tally.so/r/nWEKPQ,,[TRANSLATE-es] ,"albertbro boost global communication with multilingual support, privacy, and ease of use. ","albertbro boost global communication with multilingual support, privacy, and ease of use. "
eesel-app,Eesel App,[TRANSLATE-es] Eesel App,Transforms your browser tab into a productivity hub.…,[TRANSLATE-es] Transforms your browser tab into a productivity hub.…,personal-assistant,other,Information not available,[TRANSLATE-es] Information not available,https://www.futurepedia.io/api/og?title=Eesel+App+AI+Reviews%3A+Use+Cases%2C+Pricing+%26+Alternatives&image=https%3A%2F%2Fcdn.futurepedia.io%2Fe69794c25c3b489ab1203bcf3e15bc4e62e73e54-1900x918.png,https://soofy.io/index/ref?&r=1674589108949x536014008447273100,,[TRANSLATE-es] ,eesel app transforms your browser tab into a productivity hub. ,eesel app transforms your browser tab into a productivity hub. 
copilot2trip,Copilot2trip,[TRANSLATE-es] Copilot2trip,"Craft perfect itineraries with interactive maps, get real-time recommendations, and enjoy adaptive travel experiences…","[TRANSLATE-es] Craft perfect itineraries with interactive maps, get real-time recommendations, and enjoy adaptive travel experiences…",personal-assistant,other,Information not available,[TRANSLATE-es] Information not available,https://www.futurepedia.io/api/og?title=Copilot2trip+AI+Reviews%3A+Use+Cases%2C+Pricing+%26+Alternatives&image=https%3A%2F%2Fcdn.futurepedia.io%2Fe20006aa04ebde422c98f8fbba774aac992f9a02-2523x1249.jpg,https://tally.so/r/nWEKPQ,,[TRANSLATE-es] ,"copilot2trip craft perfect itineraries with interactive maps, get real-time recommendations, and enjoy adaptive travel experiences ","copilot2trip craft perfect itineraries with interactive maps, get real-time recommendations, and enjoy adaptive travel experiences "
usemotion,Motion,[TRANSLATE-es] Motion,"Boost productivity and manage tasks, projects, meetings seamlessly with AI.…","[TRANSLATE-es] Boost productivity and manage tasks, projects, meetings seamlessly with AI.…",personal-assistant,other,Information not available,[TRANSLATE-es] Information not available,https://www.futurepedia.io/api/og?title=Motion+AI+Reviews%3A+Use+Cases%2C+Pricing+%26+Alternatives&image=https%3A%2F%2Fcdn.futurepedia.io%2F71a6fecfeb4ef9f540604a729dd472015cf5df02-2515x1232.png,https://www.usemotion.com/,,[TRANSLATE-es] ,"motion boost productivity and manage tasks, projects, meetings seamlessly with ai. ","motion boost productivity and manage tasks, projects, meetings seamlessly with ia. "
miri,MIRI,[TRANSLATE-es] MIRI,"Revolutionize wellness with AI: personalized health coaching, expert nutrition, fitness guidance, anytime access.…","[TRANSLATE-es] Revolutionize wellness with AI: personalized health coaching, expert nutrition, fitness guidance, anytime access.…",personal-assistant,other,Information not available,[TRANSLATE-es] Information not available,https://www.futurepedia.io/api/og?title=MIRI+AI+Reviews%3A+Use+Cases%2C+Pricing+%26+Alternatives&image=https%3A%2F%2Fcdn.futurepedia.io%2F7bc33d663405fd443ff4daf51c17f57512adfae2-2520x1251.png,https://www.instagram.com/mirihealth/,,[TRANSLATE-es] ,"miri revolutionize wellness with ai: personalized health coaching, expert nutrition, fitness guidance, anytime access. ","miri revolutionize wellness with ia: personalized health coaching, expert nutrition, fitness guidance, anytime access. "
wandergenie,WanderGenie,[TRANSLATE-es] WanderGenie,Revolutionize travel with AI-driven personalized planning and real-time adjustments.…,[TRANSLATE-es] Revolutionize travel with AI-driven personalized planning and real-time adjustments.…,personal-assistant,other,Information not available,[TRANSLATE-es] Information not available,https://www.futurepedia.io/api/og?title=WanderGenie+AI+Reviews%3A+Use+Cases%2C+Pricing+%26+Alternatives&image=https%3A%2F%2Fcdn.futurepedia.io%2F87d5c126ede013ce8d0418bd951d3fdaf31a96dc-2540x1230.png,https://twitter.com/wandergenie.app,,[TRANSLATE-es] ,wandergenie revolutionize travel with ai-driven personalized planning and real-time adjustments. ,wandergenie revolutionize travel with ia-driven personalized planning and real-time adjustments. 
ai-phone,AI Phone,[TRANSLATE-es] AI Phone,"Enhance call efficiency with AI transcription, privacy, and smart replies in real-time.…","[TRANSLATE-es] Enhance call efficiency with AI transcription, privacy, and smart replies in real-time.…",personal-assistant,other,Information not available,[TRANSLATE-es] Information not available,https://www.futurepedia.io/api/og?title=AI+Phone+AI+Reviews%3A+Use+Cases%2C+Pricing+%26+Alternatives&image=https%3A%2F%2Fcdn.futurepedia.io%2F8d2045f0ea6d4798150187b97778b1fac4a6a7a8-1920x1080.webp,https://twitter.com/AIPhoneTeam,,[TRANSLATE-es] ,"ai phone enhance call efficiency with ai transcription, privacy, and smart replies in real-time. ","ia phone enhance call efficiency with ia transcription, privacy, and smart replies in real-time. "
swifty,Swifty,[TRANSLATE-es] Swifty,Your AI Assistant for Simplifying Business Travel.…,[TRANSLATE-es] Your AI Assistant for Simplifying Business Travel.…,personal-assistant,assistant,Information not available,[TRANSLATE-es] Information not available,https://www.futurepedia.io/api/og?title=Swifty+AI+Reviews%3A+Use+Cases%2C+Pricing+%26+Alternatives&image=https%3A%2F%2Fcdn.futurepedia.io%2F6917035d74fcfd961374d210add892b9d2a0219f-2538x1258.jpg,https://www.linkedin.com/company/swifty-ai/,,[TRANSLATE-es] ,swifty your ai assistant for simplifying business travel. ,swifty your ia asistente for simplifying business travel. 
skoot,Skoot,[TRANSLATE-es] Skoot,Revolutionize family travel with AI-planned itineraries and tailored activity suggestions.…,[TRANSLATE-es] Revolutionize family travel with AI-planned itineraries and tailored activity suggestions.…,personal-assistant,other,Information not available,[TRANSLATE-es] Information not available,https://www.futurepedia.io/api/og?title=Skoot+AI+Reviews%3A+Use+Cases%2C+Pricing+%26+Alternatives&image=https%3A%2F%2Fcdn.futurepedia.io%2Fbab9104c76750df5b59168602297ff4dcad34d7d-2367x1234.jpg,https://www.instagram.com/skoothere/,,[TRANSLATE-es] ,skoot revolutionize family travel with ai-planned itineraries and tailored activity suggestions. ,skoot revolutionize family travel with ia-planned itineraries and tialored activity suggestions. 
adept,Adept,[TRANSLATE-es] Adept,Automate complex workflows with precision using agentic AI.…,[TRANSLATE-es] Automate complex workflows with precision using agentic AI.…,personal-assistant,other,Information not available,[TRANSLATE-es] Information not available,https://www.futurepedia.io/api/og?title=Adept+AI+Reviews%3A+Use+Cases%2C+Pricing+%26+Alternatives&image=https%3A%2F%2Fcdn.futurepedia.io%2F2025-01-27T21-48-46.279Z-2kBVGOdsa-2tpC3NZUSTmEPKLoiRRJsal.PNG,https://twitter.com/adeptailabs,,[TRANSLATE-es] ,adept automate complex workflows with precision using agentic ai. ,adept automate complex workflows with precision using agentic ia. 
tidalflow,Tidalflow,[TRANSLATE-es] Tidalflow,"Revolutionize fitness with AI: personalized workouts, science-based advice, anytime access.…","[TRANSLATE-es] Revolutionize fitness with AI: personalized workouts, science-based advice, anytime access.…",personal-assistant,other,Information not available,[TRANSLATE-es] Information not available,https://www.futurepedia.io/api/og?title=Tidalflow+AI+Reviews%3A+Use+Cases%2C+Pricing+%26+Alternatives&image=https%3A%2F%2Fcdn.futurepedia.io%2Ff26322526c165fd87268a119abaf1554fba9d0f1-2508x1234.png,https://www.instagram.com/tidalflow.ai/,,[TRANSLATE-es] ,"tidalflow revolutionize fitness with ai: personalized workouts, science-based advice, anytime access. ","tidalflow revolutionize fitness with ia: personalized workouts, science-based advice, anytime access. "
beforesunset,BeforeSunset,[TRANSLATE-es] BeforeSunset,"Maximize productivity with AI planning, time-blocking, and team collaboration.…","[TRANSLATE-es] Maximize productivity with AI planning, time-blocking, and team collaboration.…",personal-assistant,other,Information not available,[TRANSLATE-es] Information not available,https://www.futurepedia.io/api/og?title=BeforeSunset+AI+Reviews%3A+Use+Cases%2C+Pricing+%26+Alternatives&image=https%3A%2F%2Fcdn.futurepedia.io%2F1f7e1fd612aace2ef654ad6c473ce3752568bacb-2493x1212.png,https://www.instagram.com/beforesunsetai/,,[TRANSLATE-es] ,"beforesunset maximize productivity with ai planning, time-blocking, and team collaboration. ","beforesunset maximize productivity with ia planning, time-blocking, and team collaboration. "
zencall-ai,ZenCall.ai,[TRANSLATE-es] ZenCall.ai,Streamlines multilingual call management with seamless app integration.…,[TRANSLATE-es] Streamlines multilingual call management with seamless app integration.…,personal-assistant,other,Information not available,[TRANSLATE-es] Information not available,https://www.futurepedia.io/api/og?title=ZenCall.ai+Reviews%3A+Use+Cases%2C+Pricing+%26+Alternatives&image=https%3A%2F%2Fcdn.futurepedia.io%2F2025-02-24T17-36-43.789Z-gVU9vTK9pS8NTLOqXo8nUQ9U-WFsWA4Bc.png,https://tally.so/r/nWEKPQ,,[TRANSLATE-es] ,zencall.ai streamlines multilingual call management with seamless app integration. ,zencall.ia streamlines multilingual call management with seamless app integration. 
