slug,title_en,title_es,short_description_en,short_description_es,category,app_type,pricing_en,pricing_es,image_url,redirect_url,tags_en,tags_es,search_index_en,search_index_es
fusebase-ai,FuseBase AI,[TRANSLATE-es] FuseBase AI,AI-driven tool for seamless client collaboration and project management.…,[TRANSLATE-es] AI-driven tool for seamless client collaboration and project management.…,personal-assistant,other,Information not available,[TRANSLATE-es] Information not available,https://www.futurepedia.io/api/og?title=FuseBase+AI+Reviews%3A+Use+Cases%2C+Pricing+%26+Alternatives&image=https%3A%2F%2Fcdn.futurepedia.io%2Fa4d3437d890a9dbee0aaf5f2c08fa271bfb5afde-2516x1245.png,https://www.facebook.com/nimbuswebme,,[TRANSLATE-es] ,fusebase ai ai-driven tool for seamless client collaboration and project management. ,fusebase ia ia-driven herramienta for seamless client collaboration and project management. 
ask-layla,Ask Layla,[TRANSLATE-es] Ask Layla,Revolutionize travel with AI-driven planning and seamless bookings.…,[TRANSLATE-es] Revolutionize travel with AI-driven planning and seamless bookings.…,personal-assistant,other,Information not available,[TRANSLATE-es] Information not available,https://www.futurepedia.io/api/og?title=Ask+Layla+AI+Reviews%3A+Use+Cases%2C+Pricing+%26+Alternatives&image=https%3A%2F%2Fcdn.futurepedia.io%2F47faedc0550193b88a630bc63c8d2b1545ed94bb-2492x1228.png,https://tally.so/r/nWEKPQ,,[TRANSLATE-es] ,ask layla revolutionize travel with ai-driven planning and seamless bookings. ,ask layla revolutionize travel with ia-driven planning and seamless bookings. 
noah,Noah,[TRANSLATE-es] Noah,Revolutionize legal documentation with AI-crafted demand letters.…,[TRANSLATE-es] Revolutionize legal documentation with AI-crafted demand letters.…,personal-assistant,other,Information not available,[TRANSLATE-es] Information not available,https://www.futurepedia.io/api/og?title=Noah+AI+Reviews%3A+Use+Cases%2C+Pricing+%26+Alternatives&image=https%3A%2F%2Fcdn.futurepedia.io%2F2025-02-01T02-25-25.482Z-ouvpgEETuRKLZASQ4O8IXEn-YrqXCje-r.PNG,https://www.linkedin.com/company/tavrnla/,,[TRANSLATE-es] ,noah revolutionize legal documentation with ai-crafted demand letters. ,noah revolutionize legal documentation with ia-crafted demand letters. 
zoom-ai-companion,Zoom AI Companion,[TRANSLATE-es] Zoom AI Companion,"Streamline meetings with AI summaries, chat assistance, and multilingual support.…","[TRANSLATE-es] Streamline meetings with AI summaries, chat assistance, and multilingual support.…",personal-assistant,assistant,Information not available,[TRANSLATE-es] Information not available,https://www.futurepedia.io/api/og?title=Zoom+AI+Companion+AI+Reviews%3A+Use+Cases%2C+Pricing+%26+Alternatives&image=https%3A%2F%2Fcdn.futurepedia.io%2Fe132c0d46af1135dfe026a8210c1590840e93c07-2525x1242.png,https://www.linkedin.com/company/zoom-video-communications,,[TRANSLATE-es] ,"zoom ai companion streamline meetings with ai summaries, chat assistance, and multilingual support. ","zoom ia companion streamline meetings with ia summaries, chat assistance, and multilingual support. "
goheather,goHeather,[TRANSLATE-es] goHeather,"AI-driven contract analysis, multilingual, lawyer-trained, time-saving tool.…","[TRANSLATE-es] AI-driven contract analysis, multilingual, lawyer-trained, time-saving tool.…",personal-assistant,other,Information not available,[TRANSLATE-es] Information not available,https://www.futurepedia.io/api/og?title=goHeather+AI+Reviews%3A+Use+Cases%2C+Pricing+%26+Alternatives&image=https%3A%2F%2Fcdn.futurepedia.io%2F1ae190e3d82401d4a6c6b3b69d4610679e47221e-2518x1229.png,https://www.linkedin.com/company/heatherhr/,,[TRANSLATE-es] ,"goheather ai-driven contract analysis, multilingual, lawyer-trained, time-saving tool. ","goheather ia-driven contract analysis, multilingual, lawyer-trianed, time-saving herramienta. "
chaton,ChatOn,[TRANSLATE-es] ChatOn,"Revolutionize writing and creativity with AI: text-to-image, PDF mastery, voice transcription.…","[TRANSLATE-es] Revolutionize writing and creativity with AI: text-to-image, PDF mastery, voice transcription.…",personal-assistant,assistant,Information not available,[TRANSLATE-es] Information not available,https://www.futurepedia.io/api/og?title=ChatOn+AI+Reviews%3A+Use+Cases%2C+Pricing+%26+Alternatives&image=https%3A%2F%2Fcdn.futurepedia.io%2F948fe9a9e32a076271b8e2e918850026f114ec02-1716x1057.jpg,https://tally.so/r/nWEKPQ,,[TRANSLATE-es] ,"chaton revolutionize writing and creativity with ai: text-to-image, pdf mastery, voice transcription. ","chaton revolutionize escritura and creativity with ia: text-to-imagen, pdf mastery, voice transcription. "
blitzbear,BlitzBear,[TRANSLATE-es] BlitzBear,AI-driven platform revolutionizing project management and team collaboration.…,[TRANSLATE-es] AI-driven platform revolutionizing project management and team collaboration.…,personal-assistant,other,Information not available,[TRANSLATE-es] Information not available,https://www.futurepedia.io/api/og?title=BlitzBear+AI+Reviews%3A+Use+Cases%2C+Pricing+%26+Alternatives&image=https%3A%2F%2Fcdn.futurepedia.io%2F2025-01-31T23-44-54.325Z-4axIkxgRvOwBW3CEbMbVmg9_vjqcJLWUi.PNG,https://soofy.io/index/ref?&r=1674589108949x536014008447273100,,[TRANSLATE-es] ,blitzbear ai-driven platform revolutionizing project management and team collaboration. ,blitzbear ia-driven platform revolutionizing project management and team collaboration. 
qashboard,QashBoard,[TRANSLATE-es] QashBoard,"Streamline finances with AI insights and secure, customizable data management.…","[TRANSLATE-es] Streamline finances with AI insights and secure, customizable data management.…",personal-assistant,other,Information not available,[TRANSLATE-es] Information not available,https://www.futurepedia.io/api/og?title=QashBoard+AI+Reviews%3A+Use+Cases%2C+Pricing+%26+Alternatives&image=https%3A%2F%2Fcdn.futurepedia.io%2Ff26a78496286a15efabd9ffa9316b03c16246b4e-2516x1243.png,https://twitter.com/relume_io,,[TRANSLATE-es] ,"qashboard streamline finances with ai insights and secure, customizable data management. ","qashboard streamline finances with ia insights and secure, customizable data management. "
pantera-deals,Pantera Deals,[TRANSLATE-es] Pantera Deals,"Deals surfaced from commands, not keywords.…","[TRANSLATE-es] Deals surfaced from commands, not keywords.…",personal-assistant,other,Information not available,[TRANSLATE-es] Information not available,https://www.futurepedia.io/api/og?title=Pantera+Deals+AI+Reviews%3A+Use+Cases%2C+Pricing+%26+Alternatives&image=https%3A%2F%2Fcdn.futurepedia.io%2F2025-05-14T21-57-09.870Z-6SyGzP_EWQqcwHqLlpRjvSP1LsAn9wnU5.png,https://tally.so/r/nWEKPQ,,[TRANSLATE-es] ,"pantera deals deals surfaced from commands, not keywords. ","pantera deals deals surfaced from commands, not keywords. "
gajix,GAJIX,[TRANSLATE-es] GAJIX,"Revolutionize learning with AI: instant insights, comprehensive syllabus, enhanced understanding.…","[TRANSLATE-es] Revolutionize learning with AI: instant insights, comprehensive syllabus, enhanced understanding.…",personal-assistant,other,Information not available,[TRANSLATE-es] Information not available,https://www.futurepedia.io/api/og?title=GAJIX++AI+Reviews%3A+Use+Cases%2C+Pricing+%26+Alternatives&image=https%3A%2F%2Fcdn.futurepedia.io%2F0e5cc7590fbcf452033fe24cf76c355ba48c320d-2506x1223.jpg,https://appsumo.8odi.net/xkbAPO,,[TRANSLATE-es] ,"gajix revolutionize learning with ai: instant insights, comprehensive syllabus, enhanced understanding. ","gajix revolutionize learning with ia: instant insights, comprehensive syllabus, enhanced understanding. "
luzia,Luzia,[TRANSLATE-es] Luzia,"Unlock daily tasks, creative ideas, and instant answers with Luzia.…","[TRANSLATE-es] Unlock daily tasks, creative ideas, and instant answers with Luzia.…",personal-assistant,other,Information not available,[TRANSLATE-es] Information not available,https://www.futurepedia.io/api/og?title=Luzia+AI+Reviews%3A+Use+Cases%2C+Pricing+%26+Alternatives&image=https%3A%2F%2Fcdn.futurepedia.io%2Fc846e270d67918cf0e39328c58346ed5a663a6b4-2511x1234.png,https://www.instagram.com/luzia.es/,,[TRANSLATE-es] ,"luzia unlock daily tasks, creative ideas, and instant answers with luzia. ","luzia unlock dialy tasks, creative ideas, and instant answers with luzia. "
mindy,Mindy,[TRANSLATE-es] Mindy,Transform your email into an AI-powered command center.…,[TRANSLATE-es] Transform your email into an AI-powered command center.…,personal-assistant,other,Information not available,[TRANSLATE-es] Information not available,https://www.futurepedia.io/api/og?title=Mindy+AI+Reviews%3A+Use+Cases%2C+Pricing+%26+Alternatives&image=https%3A%2F%2Fcdn.futurepedia.io%2Fffdf2d4d75187010bd3ccab368a941b72289ed83-1920x1080.png,https://www.instagram.com/mindy.insta/,,[TRANSLATE-es] ,mindy transform your email into an ai-powered command center. ,mindy transform your emial into an ia-powered command center. 
videoideas-ai,VideoIdeas.ai,[TRANSLATE-es] VideoIdeas.ai,Effortlessly generate viral YouTube scripts and growth strategies.…,[TRANSLATE-es] Effortlessly generate viral YouTube scripts and growth strategies.…,personal-assistant,generator,Information not available,[TRANSLATE-es] Information not available,https://www.futurepedia.io/api/og?title=VideoIdeas.ai+Reviews%3A+Use+Cases%2C+Pricing+%26+Alternatives&image=https%3A%2F%2Fcdn.futurepedia.io%2F2025-03-14T15-19-16.231Z-uEh2WuG_O_i95AMqS4GFHId-Y9sLuhn4c.blob,https://www.synthesia.io/?via=fp,,[TRANSLATE-es] ,videoideas.ai effortlessly generate viral youtube scripts and growth strategies. ,videoideas.ia effortlessly generate viral youtube scripts and growth strategies. 
free-ai-resume-generator,Free AI Resume Generator,[TRANSLATE-es] Free AI Resume Generator,"Create professional, ATS-optimized resumes instantly with AI.…","[TRANSLATE-es] Create professional, ATS-optimized resumes instantly with AI.…",personal-assistant,generator,Information not available,[TRANSLATE-es] Information not available,https://www.futurepedia.io/api/og?title=Free+AI+Resume+Generator+AI+Reviews%3A+Use+Cases%2C+Pricing+%26+Alternatives&image=https%3A%2F%2Fcdn.futurepedia.io%2F2024-12-30T16-40-24.896Z-J5Uuqc55xJqjPdNUwap1MJOLUOPsHAloP.blob,https://www.linkedin.com/company/remotepeoplecom/,,[TRANSLATE-es] ,"free ai resume generator create professional, ats-optimized resumes instantly with ai. ","free ia resume generador create professional, ats-optimized resumes instantly with ia. "
sanctum,Sanctum AI,[TRANSLATE-es] Sanctum AI,"Local, private AI assistant ensuring encrypted data stays on your Mac.…","[TRANSLATE-es] Local, private AI assistant ensuring encrypted data stays on your Mac.…",personal-assistant,assistant,Information not available,[TRANSLATE-es] Information not available,https://www.futurepedia.io/api/og?title=Sanctum+AI+Reviews%3A+Use+Cases%2C+Pricing+%26+Alternatives&image=https%3A%2F%2Fcdn.futurepedia.io%2F002f044de2a6be699cac8f6788d3e95b1d3a2129-2447x1168.png,https://discord.gg/gTf4GaG9eH,,[TRANSLATE-es] ,"sanctum ai local, private ai assistant ensuring encrypted data stays on your mac. ","sanctum ia local, private ia asistente ensuring encrypted data stays on your mac. "
portfoliogpt,PortfolioGPT,[TRANSLATE-es] PortfolioGPT,"Automates personalized portfolio creation, optimizing investment strategies effortlessly.…","[TRANSLATE-es] Automates personalized portfolio creation, optimizing investment strategies effortlessly.…",personal-assistant,other,Information not available,[TRANSLATE-es] Information not available,https://www.futurepedia.io/api/og?title=PortfolioGPT+AI+Reviews%3A+Use+Cases%2C+Pricing+%26+Alternatives&image=https%3A%2F%2Fcdn.futurepedia.io%2F2025-03-24T16-28-55.449Z-A1gY04ySJQ7BIYbHfAyPeeYxmBTrzibga.png,https://x.com/z_alexander_x,,[TRANSLATE-es] ,"portfoliogpt automates personalized portfolio creation, optimizing investment strategies effortlessly. ","portfoliogpt automates personalized portfolio creation, optimizing investment strategies effortlessly. "
clearword,Clearword,[TRANSLATE-es] Clearword,"AI-driven meeting assistant for note-taking, summaries, and actionable follow-ups.…","[TRANSLATE-es] AI-driven meeting assistant for note-taking, summaries, and actionable follow-ups.…",personal-assistant,assistant,Information not available,[TRANSLATE-es] Information not available,https://www.futurepedia.io/api/og?title=Clearword+AI+Reviews%3A+Use+Cases%2C+Pricing+%26+Alternatives&image=https%3A%2F%2Fcdn.futurepedia.io%2Fb0611918eb588d97e4a51c7d85871f055dae330d-2510x1235.png,https://www.linkedin.com/company/clearword/,,[TRANSLATE-es] ,"clearword ai-driven meeting assistant for note-taking, summaries, and actionable follow-ups. ","clearword ia-driven meeting asistente for note-taking, summaries, and actionable follow-ups. "
manus,Manus,[TRANSLATE-es] Manus,"Transforms thoughts into actions, enhancing productivity and efficiency.…","[TRANSLATE-es] Transforms thoughts into actions, enhancing productivity and efficiency.…",personal-assistant,other,Information not available,[TRANSLATE-es] Information not available,https://www.futurepedia.io/api/og?title=Manus+AI+Reviews%3A+Use+Cases%2C+Pricing+%26+Alternatives&image=https%3A%2F%2Fcdn.futurepedia.io%2F2025-03-11T15-08-38.637Z-OjGJk3V89az_jF09ilkxuSuXHBfN01Xww.blob,https://x.com/ManusAI_HQ,,[TRANSLATE-es] ,"manus transforms thoughts into actions, enhancing productivity and efficiency. ","manus transforms thoughts into actions, enhancing productivity and efficiency. "
twin,Twin,[TRANSLATE-es] Twin,"Automate repetitive tasks effortlessly with intelligent, action-driven AI.…","[TRANSLATE-es] Automate repetitive tasks effortlessly with intelligent, action-driven AI.…",personal-assistant,other,Information not available,[TRANSLATE-es] Information not available,https://www.futurepedia.io/api/og?title=Twin+AI+Reviews%3A+Use+Cases%2C+Pricing+%26+Alternatives&image=https%3A%2F%2Fcdn.futurepedia.io%2F18f8320a4616888b0c377dae6ec58477e02a4e3a-1920x1080.png,https://www.linkedin.com/in/clementdelangue/,,[TRANSLATE-es] ,"twin automate repetitive tasks effortlessly with intelligent, action-driven ai. ","twin automate repetitive tasks effortlessly with intelligent, action-driven ia. "
post-boost,Post-Boost,[TRANSLATE-es] Post-Boost,Schedule and post content across multiple platforms.…,[TRANSLATE-es] Schedule and post content across multiple platforms.…,personal-assistant,other,Information not available,[TRANSLATE-es] Information not available,https://www.futurepedia.io/api/og?title=Post-Boost+AI+Reviews%3A+Use+Cases%2C+Pricing+%26+Alternatives&image=https%3A%2F%2Fcdn.futurepedia.io%2F2025-07-03T18-29-06.330Z-1SaF50a8MvsgPgBvGf3v2PM3I-zjaCDe7.png,https://glambase.app/?ref=FUTUREPEDIA15,,[TRANSLATE-es] ,post-boost schedule and post content across multiple platforms. ,post-boost schedule and post content across multiple platforms. 
thunderbit,Thunderbit,[TRANSLATE-es] Thunderbit,Scrape leads & other data in just 2-clicks. Built for sales & ops teams. Powered by AI.…,[TRANSLATE-es] Scrape leads & other data in just 2-clicks. Built for sales & ops teams. Powered by AI.…,personal-assistant,other,Information not available,[TRANSLATE-es] Information not available,https://www.futurepedia.io/api/og?title=Thunderbit+AI+Reviews%3A+Use+Cases%2C+Pricing+%26+Alternatives&image=https%3A%2F%2Fcdn.futurepedia.io%2F2025-01-20T18-10-44.545Z-x61qNthJZfZ99OPnoTMXYQL7F8uYh3npZ.png,https://twitter.com/ThunderbitHQ,,[TRANSLATE-es] ,thunderbit scrape leads & other data in just 2-clicks. built for sales & ops teams. powered by ai. ,thunderbit scrape leads & other data in just 2-clicks. built for sales & ops teams. powered by ia. 
essence-app,Essence App,[TRANSLATE-es] Essence App,Optimize life with cycle-synced productivity and wellness tools.…,[TRANSLATE-es] Optimize life with cycle-synced productivity and wellness tools.…,personal-assistant,other,Information not available,[TRANSLATE-es] Information not available,https://www.futurepedia.io/api/og?title=Essence+App+AI+Reviews%3A+Use+Cases%2C+Pricing+%26+Alternatives&image=https%3A%2F%2Fcdn.futurepedia.io%2Fa1089db03c5bdc82b700641648837f398705d547-1920x1080.jpg,https://www.linkedin.com/company/theessenceapp,,[TRANSLATE-es] ,essence app optimize life with cycle-synced productivity and wellness tools. ,essence app optimize life with cycle-synced productivity and wellness herramientas. 
whoop,Whoop,[TRANSLATE-es] Whoop,"Optimize fitness, sleep, and recovery with real-time health insights.…","[TRANSLATE-es] Optimize fitness, sleep, and recovery with real-time health insights.…",personal-assistant,other,Information not available,[TRANSLATE-es] Information not available,https://www.futurepedia.io/api/og?title=Whoop+AI+Reviews%3A+Use+Cases%2C+Pricing+%26+Alternatives&image=https%3A%2F%2Fcdn.futurepedia.io%2Ff0715ef51bd6068453408120d9ef09e79098d96c-2500x1217.png,https://tally.so/r/nWEKPQ,,[TRANSLATE-es] ,"whoop optimize fitness, sleep, and recovery with real-time health insights. ","whoop optimize fitness, sleep, and recovery with real-time health insights. "
capmonster-cloud,Capmonster Cloud,[TRANSLATE-es] Capmonster Cloud,"Automates CAPTCHA-solving, enhancing productivity with AI precision.…","[TRANSLATE-es] Automates CAPTCHA-solving, enhancing productivity with AI precision.…",personal-assistant,other,Information not available,[TRANSLATE-es] Information not available,https://www.futurepedia.io/api/og?title=Capmonster+Cloud+AI+Reviews%3A+Use+Cases%2C+Pricing+%26+Alternatives&image=https%3A%2F%2Fcdn.futurepedia.io%2F2025-02-27T21-18-37.560Z-FUhSkU8F7toQUT3xuFz-6ZtuHwnW1zzPk.png,https://www.youtube.com/@CapMonsterCloud,,[TRANSLATE-es] ,"capmonster cloud automates captcha-solving, enhancing productivity with ai precision. ","capmonster cloud automates captcha-solving, enhancing productivity with ia precision. "
maxai,MaxAI.me,[TRANSLATE-es] MaxAI.me,"Revolutionize productivity with 1-Click AI: Chat, summarize, translate, and visualize effortlessly.…","[TRANSLATE-es] Revolutionize productivity with 1-Click AI: Chat, summarize, translate, and visualize effortlessly.…",personal-assistant,assistant,Information not available,[TRANSLATE-es] Information not available,https://www.futurepedia.io/api/og?title=MaxAI.me+AI+Reviews%3A+Use+Cases%2C+Pricing+%26+Alternatives&image=https%3A%2F%2Fcdn.futurepedia.io%2Fb463fd7c229c67fcd9dc53374f08508441cde0ab-2501x1224.png,https://tally.so/r/nWEKPQ,,[TRANSLATE-es] ,"maxai.me revolutionize productivity with 1-click ai: chat, summarize, translate, and visualize effortlessly. ","maxia.me revolutionize productivity with 1-click ia: chat, summarize, translate, and visualize effortlessly. "
jace,Jace,[TRANSLATE-es] Jace,"Automate tasks, optimize workflows, enhance productivity with AI.…","[TRANSLATE-es] Automate tasks, optimize workflows, enhance productivity with AI.…",personal-assistant,other,Information not available,[TRANSLATE-es] Information not available,https://www.futurepedia.io/api/og?title=Jace+AI+Reviews%3A+Use+Cases%2C+Pricing+%26+Alternatives&image=https%3A%2F%2Fcdn.futurepedia.io%2F2025-02-14T20-05-20.550Z-YTTlc8NuoyH4gAo0A_QHSeAR4axqGDW85.png,https://questionreality--snapilabs.thrivecart.com/marketingblocks-bundle-unlimited/,,[TRANSLATE-es] ,"jace automate tasks, optimize workflows, enhance productivity with ai. ","jace automate tasks, optimize workflows, enhance productivity with ia. "
kintext,Kintext,[TRANSLATE-es] Kintext,"AI-driven parenting assistant offering personalized advice, milestone tracking, and community support.…","[TRANSLATE-es] AI-driven parenting assistant offering personalized advice, milestone tracking, and community support.…",personal-assistant,assistant,Information not available,[TRANSLATE-es] Information not available,https://www.futurepedia.io/api/og?title=Kintext+AI+Reviews%3A+Use+Cases%2C+Pricing+%26+Alternatives&image=https%3A%2F%2Fcdn.futurepedia.io%2F8962e7ba57b12ef569f21a21d1bc783941a4037b-2518x1194.png,https://twitter.com/KintextAI,,[TRANSLATE-es] ,"kintext ai-driven parenting assistant offering personalized advice, milestone tracking, and community support. ","kintext ia-driven parenting asistente offering personalized advice, milestone tracking, and community support. "
dressx-me,DRESSX.me,[TRANSLATE-es] DRESSX.me,AI stylist app creates outfits from simple text prompts.…,[TRANSLATE-es] AI stylist app creates outfits from simple text prompts.…,personal-assistant,generator,Information not available,[TRANSLATE-es] Information not available,https://www.futurepedia.io/api/og?title=DRESSX.me+AI+Reviews%3A+Use+Cases%2C+Pricing+%26+Alternatives&image=https%3A%2F%2Fcdn.futurepedia.io%2Fq22FWObksNZrF2HeeIcTE0.jpg,https://www.instagram.com/dressx/,,[TRANSLATE-es] ,dressx.me ai stylist app creates outfits from simple text prompts. ,dressx.me ia stylist app creates outfits from simple text prompts. 
eve-legal,Eve Legal,[TRANSLATE-es] Eve Legal,AI-driven legal tool streamlining case management for plaintiff firms.…,[TRANSLATE-es] AI-driven legal tool streamlining case management for plaintiff firms.…,personal-assistant,other,Information not available,[TRANSLATE-es] Information not available,https://www.futurepedia.io/api/og?title=Eve+Legal+AI+Reviews%3A+Use+Cases%2C+Pricing+%26+Alternatives&image=https%3A%2F%2Fcdn.futurepedia.io%2F2025-02-14T20-07-17.883Z-8zRirnTpaNUwLPI-zSVMOduOSuWWo2rzU.png,https://twitter.com/evelegalai,,[TRANSLATE-es] ,eve legal ai-driven legal tool streamlining case management for plaintiff firms. ,eve legal ia-driven legal herramienta streamlining case management for pliantiff firms. 
mindverse,Mindverse,[TRANSLATE-es] Mindverse,AI-powered platform for enhanced decision-making and productivity optimization.…,[TRANSLATE-es] AI-powered platform for enhanced decision-making and productivity optimization.…,personal-assistant,other,Information not available,[TRANSLATE-es] Information not available,https://www.futurepedia.io/api/og?title=Mindverse+AI+Reviews%3A+Use+Cases%2C+Pricing+%26+Alternatives&image=https%3A%2F%2Fcdn.futurepedia.io%2F3167f6d3a40364da6e68d1b6fd5fd2019a8bdca5-1920x1080.png,https://www.youtube.com/@Mind-OS,,[TRANSLATE-es] ,mindverse ai-powered platform for enhanced decision-making and productivity optimization. ,mindverse ia-powered platform for enhanced decision-making and productivity optimization. 
plumb,Plumb,[TRANSLATE-es] Plumb,Automate workflows with AI templates for enhanced productivity.…,[TRANSLATE-es] Automate workflows with AI templates for enhanced productivity.…,personal-assistant,other,Information not available,[TRANSLATE-es] Information not available,https://www.futurepedia.io/api/og?title=Plumb+AI+Reviews%3A+Use+Cases%2C+Pricing+%26+Alternatives&image=https%3A%2F%2Fcdn.futurepedia.io%2F2025-02-01T01-06-27.066Z-ZYPeNCu14n4yCTdaKofxNZb_1Ik6FXmsk.PNG,https://twitter.com/useplumb,,[TRANSLATE-es] ,plumb automate workflows with ai templates for enhanced productivity. ,plumb automate workflows with ia templates for enhanced productivity. 
evenup-law,EvenUp Law,[TRANSLATE-es] EvenUp Law,AI-powered tool for efficient demand packages and medical chronologies.…,[TRANSLATE-es] AI-powered tool for efficient demand packages and medical chronologies.…,personal-assistant,other,Information not available,[TRANSLATE-es] Information not available,https://www.futurepedia.io/api/og?title=EvenUp+Law+AI+Reviews%3A+Use+Cases%2C+Pricing+%26+Alternatives&image=https%3A%2F%2Fcdn.futurepedia.io%2F2025-02-14T20-08-56.763Z-NQsg5fUq5k2IZyfD0CRpEWvhC08IZLheM.png,https://www.facebook.com/EvenUpLaw,,[TRANSLATE-es] ,evenup law ai-powered tool for efficient demand packages and medical chronologies. ,evenup law ia-powered herramienta for efficient demand packages and medical chronologies. 
bible-chat,Bible Chat,[TRANSLATE-es] Bible Chat,"Explore scripture, deepen faith, interactive AI-driven guidance.…","[TRANSLATE-es] Explore scripture, deepen faith, interactive AI-driven guidance.…",personal-assistant,assistant,Information not available,[TRANSLATE-es] Information not available,https://www.futurepedia.io/api/og?title=Bible+Chat+AI+Reviews%3A+Use+Cases%2C+Pricing+%26+Alternatives&image=https%3A%2F%2Fcdn.futurepedia.io%2Fc7731fd40352a0cbf044f764db8c4fa56b358916-1920x1080.png,https://www.instagram.com/the.biblechat,,[TRANSLATE-es] ,"bible chat explore scripture, deepen faith, interactive ai-driven guidance. ","bible chat explore scripture, deepen fiath, interactive ia-driven guidance. "
turbo,Turbo,[TRANSLATE-es] Turbo,"Fast conversational AI for instant, human-like responses.…","[TRANSLATE-es] Fast conversational AI for instant, human-like responses.…",personal-assistant,other,Information not available,[TRANSLATE-es] Information not available,https://www.futurepedia.io/api/og?title=Turbo+AI+Reviews%3A+Use+Cases%2C+Pricing+%26+Alternatives&image=https%3A%2F%2Fcdn.futurepedia.io%2Fef995cbc062edc38ad59e243fa12f13eaffd7fc3-2501x1229.png,https://tally.so/r/nWEKPQ,,[TRANSLATE-es] ,"turbo fast conversational ai for instant, human-like responses. ","turbo fast conversational ia for instant, human-like responses. "
copilot-for-microsoft-365,Copilot for Microsoft 365,[TRANSLATE-es] Copilot for Microsoft 365,Transforms Microsoft 365 into an AI-driven productivity powerhouse.…,[TRANSLATE-es] Transforms Microsoft 365 into an AI-driven productivity powerhouse.…,personal-assistant,other,Information not available,[TRANSLATE-es] Information not available,https://www.futurepedia.io/api/og?title=Copilot+for+Microsoft+365+AI+Reviews%3A+Use+Cases%2C+Pricing+%26+Alternatives&image=https%3A%2F%2Fcdn.futurepedia.io%2F5ba4654c11026f8a03ff29ad1ffd69a8a9985b64-2520x1235.png,https://tally.so/r/nWEKPQ,,[TRANSLATE-es] ,copilot for microsoft 365 transforms microsoft 365 into an ai-driven productivity powerhouse. ,copilot for microsoft 365 transforms microsoft 365 into an ia-driven productivity powerhouse. 
